#EXTM3U
#EXTINF:-1, Avatar Way of Water
http://hd4.dlmania.com/Hollywood/Avatar%20-%20The%20Way%20of%20Water%20-%20BRRip/Avatar%20-%20The%20Way%20of%20Water%20-%20BRRip%20HD%20(HDMp4Mania).mp4
#EXTINF:-1, John Wick 4
http://hd1.dlmania.com/Hollywood/John%20Wick%20-%20Chapter%204%20-%20SCam/John%20Wick%20-%20Chapter%204%20-%20SCam%20HD%20(HDMp4Mania).mp4
#EXTINF:-1, Creed 3
http://hd1.dlmania.com/Hollywood/Creed%20III%20-%20BRRip/Creed%20III%20-%20BRRip%20HD%20(HDMp4Mania).mp4
#EXTINF:-1, Shazam - Fury of the Gods
http://hd1.dlmania.com/Hollywood/Shazam%20-%20Fury%20of%20the%20Gods%20-%20BRRip/Shazam%20-%20Fury%20of%20the%20Gods%20-%20BRRip%20HD%20(HDMp4Mania).mp4
#EXTINF:-1, The Last Kingdom - Seven Kings Must Die
http://hd2.dlmania.com/Hollywood/The%20Last%20Kingdom%20-%20Seven%20Kings%20Must%20Die%20-%20BRRip/The%20Last%20Kingdom%20-%20Seven%20Kings%20Must%20Die%20-%20BRRip%20HD%20(HDMp4Mania).mp4
#EXTINF:-1, A Few Good Men
http://45.200.133.5:8089/A%20Few%20Good%20Men/movie.mkv
#EXTINF:-1, Lord of Rings1
http://45.200.133.5:8089/The%20Lord%20of%20the%20Rings%20The%20Fellowship%20of%20the%20Ring/movie.mp4
#EXTINF:-1, The Passion of Christ
http://45.200.133.5:8089/The%20Passion%20of%20the%20Christ/movie.mp4
#EXTINF:-1, Godfather
http://45.200.133.5:8089/The%20Godfather/movie.mp4
#EXTINF:-1, Godfather2
http://45.200.133.5:8089/The%20Godfather%20Part%202/movie.mp4
#EXTINF:-1, Godfather3
http://45.200.133.5:8089/The%20Godfather%20Part%203/movie.mp4
#EXTINF:-1, Godfather
https://dl3.3rver.org/cdn2/02/film/1972/The%20Godfather/The.Godfather.1972.720p.BluRay.MkvCage.mkv
#EXTINF:-1, Jurassic World Dominion
http://hd1.dlmania.com/Hollywood/Jurassic%20World%20Dominion%20-%20SCam/Jurassic%20World%20Dominion%20-%20SCam%20HD%20(HDMp4Mania).mp4
#EXTINF:-1, Avatar Way of Water
http://hd1.dlmania.com/Hollywood/Avatar%20-%20The%20Way%20of%20Water%20-%20SCam/Avatar%20-%20The%20Way%20of%20Water%20-%20SCam%20HD%20(HDMp4Mania).mp4
#EXTINF:-1, Ant Man and the Wasp Quantumania 
http://hd1.dlmania.com/Hollywood/Ant-Man%20and%20the%20Wasp%20-%20Quantumania%20-%20SCam/Ant-Man%20and%20the%20Wasp%20-%20Quantumania%20-%20SCam%20HD%20(HDMp4Mania).mp4
#EXTINF:-1, John Wick 4
http://hd1.dlmania.com/Hollywood/John%20Wick%20-%20Chapter%204%20-%20SCam/John%20Wick%20-%20Chapter%204%20-%20SCam%20HD%20(HDMp4Mania).mp4
#EXTINF:-1, HOBBIT Five Armies
https://cloclo50.cloud.mail.ru/videowl/0p/ZGRldy9WZ1djQ3NXamUvMzI1MDQubWt2.m3u8?double_encode=1
#EXTINF:-1, Black Panther 2
https://cloclo60.cloud.mail.ru/videowl/0p/R0x1OS84b2M0VnRRR2cvbGlzdC5tcDQ=.m3u8?double_encode=1
#EXTINF:-1, Predator
http://deadlyblogger.com/NewRelease/predator1987.mp4
#EXTINF:-1, Predator 2
http://deadlyblogger.com/NewRelease/predator2.mp4
#EXTINF:-1, Predators
http://deadlyblogger.com/NewRelease/predator2010.mp4
#EXTINF:-1, Avatar
http://deadlyblogger.com/NewRelease/avatar2010.mp4
#EXTINF:-1, Guardians Of The Galaxy Vol 3 (2023) 
https://www.moviesyug.org/downloadfile/26259.html
#EXTINF:-1,Bulletproof Monk
http://vod3.freeddns.org:80/14920271211/bulletproofmonk.mp4
#EXTINF:-1, Top Gun Maverick
https://www.moviesyug.org/downloadfile/25001.html
#EXTINF:-1, (500) Days of Summer
http://vod1.freeddns.org:80/13774202158/500Days.mp4
#EXTINF:-1, 4: Apocalypse
http://vod3.freeddns.org:80/195181173146/movies/Rec4-2014.mp4
#EXTINF:-1, 101 Dalmatians
http://vod3.freeddns.org:80/195181164146/101Dalmatians.mp4
#EXTINF:-1, 102 Minutes That Changed America
http://vod3.freeddns.org:80/217182172100/102Mins.mp4
#EXTINF:-1, 12 Years a Slave
http://vod3.freeddns.org:80/195181164146/12YearsASlave.mp4
#EXTINF:-1, 1985
http://vod3.freeddns.org:80/145239129162/old0619/1985-2018.mp4
#EXTINF:-1, 2 Guns
http://vod3.freeddns.org:80/195181164146/TwoGuns2013.mp4
#EXTINF:-1, 28 Days Later...
http://vod1.freeddns.org:80/148251187141/28Days.mp4
#EXTINF:-1, 3 Idiots
http://vod3.freeddns.org:80/195181164146/3Idiots.mp4
#EXTINF:-1, 3 Little Pigs and the Magic Lamp
http://vod3.freeddns.org:80/1492026922/3littlepigs.mp4
#EXTINF:-1, 300: Rise of an Empire
http://vod1.freeddns.org:80/13774202158/Rise.mp4
#EXTINF:-1, 40 Days and 40 Nights
http://vod1.freeddns.org:80/519692115/40DaysAnd40Nights.mp4
#EXTINF:-1, 45 Years
http://vod3.freeddns.org:80/1492026922/45Years.mp4
#EXTINF:-1, 48 Hrs.
http://vod3.freeddns.org:80/519682224/48Hours-1982.mp4
#EXTINF:-1, 8 Mile
http://vod1.freeddns.org:80/1482511210/8MileA.mp4
#EXTINF:-1, 88 Minutes
http://vod1.freeddns.org:80/519692115/88Minutes.mp4
#EXTINF:-1, A Beautiful Mind
http://vod3.freeddns.org:80/195181164146/BeautifulMind.mp4
#EXTINF:-1, A Brilliant Young Mind
http://vod3.freeddns.org:80/151809610/XY.mp4
#EXTINF:-1, A Charlie Brown Christmas
http://vod1.freeddns.org:80/519692115/CharlieXmas.mp4
#EXTINF:-1, A Cinderella Story: If the Shoe Fits
http://vod3.freeddns.org:80/14920266145/ACinderellaStoryIfTheShoeFits-2016.mp4
#EXTINF:-1, A Cinderella Story: Once Upon a Song
http://vod3.freeddns.org:80/14920266145/ACinderellaStoryOnceUponASong-2011.mp4
#EXTINF:-1, A Fish Called Wanda
http://vod3.freeddns.org:80/195181173146/movies/AFishCalledWanda-1988.mp4
#EXTINF:-1, A Fistful of Dollars
http://vod1.freeddns.org:80/1482511210/AFistful.mp4
#EXTINF:-1, A Haunted House
http://vod1.freeddns.org:80/519692115/AHauntedHouse.mp4
#EXTINF:-1, A Haunted House 2
http://vod1.freeddns.org:80/519692115/AHauntedHouse2.mp4
#EXTINF:-1, Alpha
http://vod5.freeddns.org:80/95154195215/boxoffice2/Alpha-2018.mp4
#EXTINF:-1, Alpha and Omega: The Big Fureeze
http://vod3.freeddns.org:80/1492026922/alphaomegafureeze.mp4
#EXTINF:-1, Alvin and the Chipmunks: The Road Chip
http://vod3.freeddns.org:80/51254199141/alvin.mp4
#EXTINF:-1, Amadeus
http://vod3.freeddns.org:80/195181164146/Amadeus.mp4
#EXTINF:-1, America\s Next Top Model Season 24
http://vod3.freeddns.org:80/195181164146/series/AmericasNextTopModel-S24E14.mp4
#EXTINF:-1, American Gangster
http://vod3.freeddns.org:80/195181164146/AmericanGangster.mp4
#EXTINF:-1, American Hustle
http://vod1.freeddns.org:80/13774202158/Hustle.mp4
#EXTINF:-1, American Music Awards 2016
http://vod1.freeddns.org:80/148251187141/AMAs.mp4
#EXTINF:-1, American Pie 2
http://vod3.freeddns.org:80/217182172100/AmericanPie2.mp4
#EXTINF:-1, American Pie 3 - The Wedding
http://vod3.freeddns.org:80/217182172100/AmericanPie3-TheWedding.mp4
#EXTINF:-1, American Pie 4 - Reunion
http://vod3.freeddns.org:80/217182172100/AmericanPie4-TheReunion.mp4
#EXTINF:-1, American Pie 5 - Band Camp
http://vod3.freeddns.org:80/217182172100/AmericanPie5-BandCamp.mp4
#EXTINF:-1, American Pie 6 - The Naked Mile
http://vod3.freeddns.org:80/217182172100/AmericanPie6-TheNakedMile.mp4
#EXTINF:-1, American Pie 7 - Beta House
http://vod3.freeddns.org:80/217182172100/AmericanPie7-BetaHouse.mp4
#EXTINF:-1, Apostle
http://vod5.freeddns.org:80/95154195215/boxoffice2/Apostle-2018.mp4
#EXTINF:-1, Aquamarine
http://vod3.freeddns.org:80/151809784/Aquamarine.mp4
#EXTINF:-1, Are We Done Yet?
http://vod1.freeddns.org:80/519692115/AreWeDoneYet.mp4
#EXTINF:-1, Armored
http://vod1.freeddns.org:80/519692115/Armored.mp4
#EXTINF:-1, Around the World in 80 Days (1956)
http://vod3.freeddns.org:80/519682224/AroundTheWorldIn80Days-1956.mp4
#EXTINF:-1, Astro Kid
http://vod3.freeddns.org:80/14920266145/AstroKid.mp4
#EXTINF:-1, Astronaut
http://vod3.freeddns.org:80/14920266145/Astronaut.2019.720p.WEB-DL.XviD.AC3-FGT.mp4
#EXTINF:-1, At Last: Mayweather v Pacquiao
http://vod1.freeddns.org:80/148251187141/AtLast.mp4
#EXTINF:-1, Atlantic City
http://vod3.freeddns.org:80/195181173146/Atlantic.City.1980.720p.BluRay.x264.mp4
#EXTINF:-1, Atlantic Rim: Resurrection
http://vod1.freeddns.org:80/519692115/AtlanticRim-2-Resurrection.mp4
#EXTINF:-1, Atlantis: The Lost Empire
http://vod3.freeddns.org:80/195181173146/Atlantis.The.Lost.Empire.2001.720p.BRrip.x264.GAZ.YIFY.mp4
#EXTINF:-1, Atomic Blonde
http://vod3.freeddns.org:80/217182132110/AtomicBlonde.mp4
#EXTINF:-1, Austin Powers: International Man of Mystery
http://vod3.freeddns.org:80/217182172100/AP1.mp4
#EXTINF:-1, Austin Powers: The Spy Who Shagged Me
http://vod3.freeddns.org:80/217182172100/AP2.mp4
#EXTINF:-1, Avengement
http://vod3.freeddns.org:80/14920266145/Avengement-2019.mp4
#EXTINF:-1, Babe
http://vod3.freeddns.org:80/195181164146/Babe.mp4
#EXTINF:-1, Baby
http://vod3.freeddns.org:80/151809610/Baby.mp4
#EXTINF:-1, Baby Mama
http://vod3.freeddns.org:80/519682224/BabyMana.mp4
#EXTINF:-1, Bachelor Party
http://vod3.freeddns.org:80/519682224/BachelorParty.mp4
#EXTINF:-1, Backdraft
http://vod3.freeddns.org:80/51254199141/Backdraft.mp4
#EXTINF:-1, Bad Boys
http://vod3.freeddns.org:80/145239129162/old0619/badboys.mp4
#EXTINF:-1, Bad Boys II
http://vod3.freeddns.org:80/145239129162/old0619/badboys2.mp4
#EXTINF:-1, Bad Moms
http://vod3.freeddns.org:80/14920271211/badmoms.mp4
#EXTINF:-1, Bad Neighbors
http://vod3.freeddns.org:80/195181164146/BadNeighbors.mp4
#EXTINF:-1, Bad Santa
http://vod1.freeddns.org:80/519692115/BadSanta.mp4
#EXTINF:-1, Barbershop
http://vod1.freeddns.org:80/519692115/Barbershop1.mp4
#EXTINF:-1, Barbie: Star Light Adventure
http://vod3.freeddns.org:80/1492028071/barbiestar.mp4
#EXTINF:-1, Basic Instinct
http://vod3.freeddns.org:80/217182172100/basicinstinct.mp4
#EXTINF:-1, Basic Instinct 2
http://vod3.freeddns.org:80/217182172100/basicinstinct2.mp4
#EXTINF:-1, Batman
http://vod1.freeddns.org:80/519692115/Batman.mp4
#EXTINF:-1, Batman & Bill
http://vod3.freeddns.org:80/51254199141/batman&bill.mp4
#EXTINF:-1, Batman & Mr. Freeze: SubZero
http://vod3.freeddns.org:80/1492028071/batman-mrfreezesubzero.mp4
#EXTINF:-1, Batman & Robin
http://vod1.freeddns.org:80/1518018170/batrob.mp4
#EXTINF:-1, Batman and Harley Quinn
http://vod3.freeddns.org:80/195181164146/BatmanAndHarleyQuinn.mp4
#EXTINF:-1, Batman Ninja
http://vod5.freeddns.org:80/95154195215/boxoffice/Batman.Ninja.2018.720p.BluRay.x264.mp4
#EXTINF:-1, Batman Returns
http://vod1.freeddns.org:80/519692115/BatmanReturns.mp4
#EXTINF:-1, Batman Unlimited: Monster Mayhem
http://vod3.freeddns.org:80/151809610/BatmanUn.mp4
#EXTINF:-1, Batman vs. Teenage Mutant Ninja Turtles
http://vod3.freeddns.org:80/14920266145/BatmanVsTeenageMutantNinjaTurtles-2019.mp4
#EXTINF:-1, Batman vs. Two-Face
http://vod3.freeddns.org:80/217182164125/BatmanTwoFace.mp4
#EXTINF:-1, Batman: Assault on Arkham
http://vod1.freeddns.org:80/1482511210/BatmanAss.mp4
#EXTINF:-1, Batman: Bad Blood
http://vod1.freeddns.org:80/519692115/batmanbad.mp4
#EXTINF:-1, Batman: Gotham by Gaslight
http://vod3.freeddns.org:80/195181164146/BatmanGaslight.mp4
#EXTINF:-1, Batman: Hush
http://vod3.freeddns.org:80/14920266145/Batman.Hush.2019.1080p.WEB-DL.DD5.1.H264-FGT.mp4
#EXTINF:-1, Batman: Mystery of the Batwoman
http://vod3.freeddns.org:80/1492028071/batman-mysteryofthebatwoman.mp4
#EXTINF:-1, Batman: The Killing Joke
http://vod3.freeddns.org:80/1492028071/batman-thekillingjoke.mp4
#EXTINF:-1, Battle Royale
http://vod1.freeddns.org:80/519692115/BattleRoyale.mp4
#EXTINF:-1, Baywatch 2017
http://vod3.freeddns.org:80/519682224/baywatch2017.mp4
#EXTINF:-1, BBC - Rome: A History Of The Eternal City (Mini-Series)
http://vod3.freeddns.org:80/14920271211/series/BBC-Rome-AHistoryOfTheEternalCity-s01e03.mp4
#EXTINF:-1, BBC Aliens The Big Think
http://vod1.freeddns.org:80/1518018170/bbcalien.mp4
#EXTINF:-1, BBC Horizon The Wildest Weather in the Universe
http://vod3.freeddns.org:80/51254199141/HorizonWild.mp4
#EXTINF:-1, BBC Panorama : Africa\s Billion Pound Migrant Trail
http://vod3.freeddns.org:80/195181164146/BBCAfricaBillion.mp4
#EXTINF:-1, Coyote Ugly
http://vod3.freeddns.org:80/195181164146/coyoteugly.mp4
#EXTINF:-1, Crack in the World
http://vod3.freeddns.org:80/195181173146/Crack.In.The.World.1965.720p.WEBRip.x264.mp4
#EXTINF:-1, Cradle to Grave Season 1
http://vod3.freeddns.org:80/217182172100/series/cradletograve-s01e08.mp4
#EXTINF:-1, Crank: High Voltage
http://vod1.freeddns.org:80/519692115/Crank-HighVoltage.mp4
#EXTINF:-1, Crazy Heart
http://vod1.freeddns.org:80/519692115/CrazyHeart.mp4
#EXTINF:-1, Creating Freedom: The Lottery of Birth
http://vod3.freeddns.org:80/195181164146/TheLotteryofBirth.mp4
#EXTINF:-1, Creed II
http://vod3.freeddns.org:80/145239129162/old0619/Creed2-2018.mp4
#EXTINF:-1, Crimson Peak
http://vod3.freeddns.org:80/217182172100/CrimsonPeak.mp4
#EXTINF:-1, Critters
http://vod3.freeddns.org:80/217182172100/Critters.mp4
#EXTINF:-1, Crocodile Dundee
http://vod1.freeddns.org:80/519692115/croc.mp4
#EXTINF:-1, Crocodile Dundee II
http://vod3.freeddns.org:80/1518026228/CrocodileDundeeII.mp4
#EXTINF:-1, Crocodile Dundee in Los Angeles
http://vod3.freeddns.org:80/1518026228/CrocDundeeLA.mp4
#EXTINF:-1, Crossroads 1986
http://vod1.freeddns.org:80/519692115/Crossroads-1986.mp4
#EXTINF:-1, Crown Heights
http://vod3.freeddns.org:80/217182164138/CrownHeights.mp4
#EXTINF:-1, Cruel Intentions 2
http://vod3.freeddns.org:80/1492026922/cruelintentions2.mp4
#EXTINF:-1, Cruel Intentions 3
http://vod3.freeddns.org:80/1492026922/cruelintentions3.mp4
#EXTINF:-1, Cube
http://vod3.freeddns.org:80/195181164146/Cube.mp4
#EXTINF:-1, Cujo
http://vod3.freeddns.org:80/195181173146/movies/Cujo-1983.mp4
#EXTINF:-1, Curious George
http://vod3.freeddns.org:80/217182172100/CuriousGeorge.mp4
#EXTINF:-1, Curious George Comes to America
http://vod3.freeddns.org:80/217182172100/curiousamerica.mp4
#EXTINF:-1, Curious George Goes to Hospital
http://vod3.freeddns.org:80/217182172100/curioushosp.mp4
#EXTINF:-1, Curious George: A Very Monkey Christmas
http://vod3.freeddns.org:80/217182172100/CuriousXmas.mp4
#EXTINF:-1, Daffy Duck\s Movie: Fantastic Island
http://vod3.freeddns.org:80/5125579157/DaffyDucksMovieFantasticIsland1983.mp4
#EXTINF:-1, Dagon
http://vod3.freeddns.org:80/195181173146/Dagon.2001.UNCUT.720p.BluRay.H264.AAC-RARBG.mp4
#EXTINF:-1, Dan Aykroyd - Unplugged On UFO\s
http://vod3.freeddns.org:80/51254199141/Aykroyd.mp4
#EXTINF:-1, Dances with Wolves
http://vod3.freeddns.org:80/217182172100/danceswith.mp4
#EXTINF:-1, Dark Water
http://vod3.freeddns.org:80/195181164146/DarkWater.mp4
#EXTINF:-1, Darkman
http://vod3.freeddns.org:80/519682224/Darkman-1990.mp4
#EXTINF:-1, Dave Chappelle: Deep in the Heart of Texas
http://vod3.freeddns.org:80/195181164146/DaveChappelleDeep.mp4
#EXTINF:-1, Dave Chappelle: Killin\ Them Softly
http://vod1.freeddns.org:80/1518018170/davechappellekillin.mp4
#EXTINF:-1, Dave Chappelle: Sticks & Stones
http://vod3.freeddns.org:80/195181173146/Dave.Chappelle.Sticks.and.Stones.2019.1080p.WEBRip.x264-RARBG.mp4
#EXTINF:-1, Dave Chappelle: The Age of Spin
http://vod3.freeddns.org:80/195181164146/DaveChappelleTheAgeofSpin.mp4
#EXTINF:-1, Dave Chappelle\s Block Party
http://vod3.freeddns.org:80/195181164146/DaveChappelleblockparty.mp4
#EXTINF:-1, Dawn of the Planet of the Apes
http://vod3.freeddns.org:80/195181173146/movies/DawnOfThePlanetOfTheApes-2014.mp4
#EXTINF:-1, Dawn of the Planet of the Apes (3D)
http://vod3.freeddns.org:80/151809610/Dawn3D.mp4
#EXTINF:-1, Daylight\s End
http://vod3.freeddns.org:80/195181164146/DaylightsEnd.mp4
#EXTINF:-1, Days of Power
http://vod3.freeddns.org:80/195181164146/DaysOfPower2018.mp4
#EXTINF:-1, Days of Thunder
http://vod3.freeddns.org:80/51254199141/DaysOfThunder.mp4
#EXTINF:-1, Dead Rising: Endgame
http://vod3.freeddns.org:80/195181173146/movies/DeadRisingEndgame-2016.mp4
#EXTINF:-1, Dead Rising: Watchtower
http://vod3.freeddns.org:80/151809610/DeadRising.mp4
#EXTINF:-1, Deadpool 2
http://vod5.freeddns.org:80/95154195215/boxoffice/Deadpool2-2018.mp4
#EXTINF:-1, Deadwood: The Movie
http://vod1.freeddns.org:80/95154195215h/movies/DeadwoodTheMovie-2019.mp4
#EXTINF:-1, Dear White People
http://vod1.freeddns.org:80/13774202158/DearWhite.mp4
#EXTINF:-1, Deception
http://vod1.freeddns.org:80/519692115/Deception.mp4
#EXTINF:-1, Deep Impact
http://vod1.freeddns.org:80/519692115/deepimpact.mp4
#EXTINF:-1, Deja Vu
http://vod1.freeddns.org:80/519692115/DejaVu.mp4
#EXTINF:-1, Delivery Man
http://vod1.freeddns.org:80/148251187141/DeliveryMan.mp4
#EXTINF:-1, Demolition
http://vod3.freeddns.org:80/51254199141/Demolition.mp4
#EXTINF:-1, Dennis the Menace
http://vod1.freeddns.org:80/1518018170/dennisthemenace.mp4
#EXTINF:-1, Depraved
http://vod3.freeddns.org:80/14920266145/Depraved-2019.mp4
#EXTINF:-1, Descendants
http://vod3.freeddns.org:80/195181164146/Descendants.mp4
#EXTINF:-1, Descendants 2
http://vod3.freeddns.org:80/195181164146/Descendants2.mp4
#EXTINF:-1, Descendants 3
http://vod1.freeddns.org:80/95154195215h/movies/Descendants3-2019.mp4
#EXTINF:-1, Desperado
http://vod3.freeddns.org:80/217182172100/Desperado.mp4
#EXTINF:-1, Despicable Me
http://vod3.freeddns.org:80/195181173146/DespicableMe.mp4
#EXTINF:-1, Despicable Me 3
http://vod3.freeddns.org:80/195181173146/despicableme3.mp4
#EXTINF:-1, Destroyer
http://vod3.freeddns.org:80/195181173146/movies/Destroyer.mp4
#EXTINF:-1, Diamonds Are Forever
http://vod3.freeddns.org:80/217182172100/DiamondsForever.mp4
#EXTINF:-1, Diary of a Butterfly
http://vod3.freeddns.org:80/195181164146/DiaryofaButterfly.mp4
#EXTINF:-1, Diary of a Wimpy Kid
http://vod1.freeddns.org:80/519692115/wimpy.mp4
#EXTINF:-1, Diary of a Wimpy Kid: Dog Days
http://vod1.freeddns.org:80/519692115/wimpydog.mp4
#EXTINF:-1, Diary of a Wimpy Kid: Rodrick Rules
http://vod3.freeddns.org:80/1492028071/wimpyrod.mp4
#EXTINF:-1, Diary of a Wimpy Kid: The Long Haul
http://vod3.freeddns.org:80/1492028071/diaryofwimpykidlonghaul.mp4
#EXTINF:-1, Dick Tracy
http://vod3.freeddns.org:80/519682224/DickTracy-AlPacinoAction-1990.mp4
#EXTINF:-1, Die Another Day
http://vod3.freeddns.org:80/14920271211/dieanotherday.mp4
#EXTINF:-1, Die Hard 2
http://vod3.freeddns.org:80/151809610/DieHard2.mp4
#EXTINF:-1, Die Hard 4: Live Free or Die Hard
http://vod3.freeddns.org:80/151809610/DieHard4.mp4
#EXTINF:-1, Die Hard: With a Vengeance
http://vod3.freeddns.org:80/151809610/DieHard3.mp4
#EXTINF:-1, Dirty 30
http://vod3.freeddns.org:80/195181164146/Dirty30.mp4
#EXTINF:-1, Dirty Grandpa
http://vod3.freeddns.org:80/51254199141/dirtygranpa.mp4
#EXTINF:-1, Dirty John
http://vod3.freeddns.org:80/195181173146/docs/DirtyJohnTheDirtyTruth-2019.mp4
#EXTINF:-1, Dirty Lies
http://vod3.freeddns.org:80/1492026922/DirtyLies.mp4
#EXTINF:-1, Dirty Rotten Scoundrels
http://vod3.freeddns.org:80/519682224/dirtyrottenscoundrels.mp4
#EXTINF:-1, Discovery :Waterfront Cities of the World
http://vod3.freeddns.org:80/14920271211/Discovery.Waterfront.Cities.of.the.World.London.mp4
#EXTINF:-1, Discovery Great White Invasion
http://vod3.freeddns.org:80/1492026922/DiscoveryGreatWhiteInvasion.mp4
#EXTINF:-1, Discovery: Dark Side of the Sun
http://vod3.freeddns.org:80/195181164146/DarkSideoftheSun.mp4
#EXTINF:-1, Doc Hollywood
http://vod3.freeddns.org:80/217182164125/DocHollywood.mp4
#EXTINF:-1, Doc McStuffins: Christmas.Special
http://vod3.freeddns.org:80/145239129162/old0619/DocMucStuffinsXmas.mp4
#EXTINF:-1, Doctor Dolittle (1967)
http://vod3.freeddns.org:80/195181164146/DoctorDolittle1967.mp4
#EXTINF:-1, Doctor Strange
http://vod3.freeddns.org:80/51254199141/doctorstrange.mp4
#EXTINF:-1, Doctor Zhivago
http://vod1.freeddns.org:80/1482511210/DoctorZhivago.mp4
#EXTINF:-1, Doghouse
http://vod3.freeddns.org:80/195181173146/movies/Doghouse-2009.mp4
#EXTINF:-1, Dogma
http://vod1.freeddns.org:80/519692115/Dogma.mp4
#EXTINF:-1, Dolemite Is My Name
http://vod3.freeddns.org:80/14920266145/DolemiteIsMyName-2019.mp4
#EXTINF:-1, Dolls House
http://vod3.freeddns.org:80/1492028071/DollsHouse.mp4
#EXTINF:-1, Dolphin Tale 2
http://vod1.freeddns.org:80/13774202158/DolphinTale2.mp4
#EXTINF:-1, Domino
http://vod1.freeddns.org:80/519692115/Domino.mp4
#EXTINF:-1, Donnie Brasco
http://vod3.freeddns.org:80/1492026922/donniebrasco.mp4
#EXTINF:-1, Dracula Untold
http://vod1.freeddns.org:80/13774202158/DracUntold.mp4
#EXTINF:-1, Dragnet
http://vod3.freeddns.org:80/519682224/Dragnet.mp4
#EXTINF:-1, Dream Girl
http://vod3.freeddns.org:80/195181173146/DreamGirl.mp4
#EXTINF:-1, Dreamgirls
http://vod1.freeddns.org:80/519692115/Dreamgirls.mp4
#EXTINF:-1, Dreamscape
http://vod3.freeddns.org:80/51254199141/Dreamscape.mp4
#EXTINF:-1, Dumbo
http://vod1.freeddns.org:80/13774202158/Dumbo.mp4
#EXTINF:-1, Dune
http://vod3.freeddns.org:80/195181173146/movies/Dune-1984.mp4
#EXTINF:-1, E.T. the Extra-Terrestrial
http://vod1.freeddns.org:80/13774202158/ET.mp4
#EXTINF:-1, Early Man
http://vod5.freeddns.org:80/95154195215/boxoffice/EarlyMan-2018.mp4
#EXTINF:-1, Empire of the Sun
http://vod1.freeddns.org:80/519692115/EmpireSun.mp4
#EXTINF:-1, Empire State
http://vod3.freeddns.org:80/519682224/EmpireState.mp4
#EXTINF:-1, Enchanted
http://vod3.freeddns.org:80/217182172100/Enchanted.mp4
#EXTINF:-1, Enemy
http://vod3.freeddns.org:80/195181173146/movies/Enemy-2013.mp4
#EXTINF:-1, Enemy of the State
http://vod3.freeddns.org:80/51254199141/enemyofthestate.mp4
#EXTINF:-1, Enter the Dragon
http://vod3.freeddns.org:80/217182172100/EnterDragon.mp4
#EXTINF:-1, Eraser
http://vod3.freeddns.org:80/1492026922/Eraser.mp4
#EXTINF:-1, Eraserhead
http://vod3.freeddns.org:80/217182172100/Eraserhead.mp4
#EXTINF:-1, Erin Brockovich
http://vod3.freeddns.org:80/51254199141/erin.mp4
#EXTINF:-1, Escape from Alcatraz
http://vod1.freeddns.org:80/1482511210/EscapeFrom.mp4
#EXTINF:-1, Escape from Planet Earth
http://vod3.freeddns.org:80/1492026922/escapefromplanetearth.mp4
#EXTINF:-1, Evan Almighty
http://vod1.freeddns.org:80/519692115/EvanAlmighty.mp4
#EXTINF:-1, Extortion
http://vod3.freeddns.org:80/51254199141/Extortion.mp4
#EXTINF:-1, Face/Off
http://vod3.freeddns.org:80/217182172100/faceoff.mp4
#EXTINF:-1, Fantastic 4
http://vod3.freeddns.org:80/1492028071/Fantastic4.mp4
#EXTINF:-1, Fantastic 4: Rise of the Silver Surfer
http://vod3.freeddns.org:80/1492028071/Fantastic4Rise.mp4
#EXTINF:-1, Fantastic Four
http://vod3.freeddns.org:80/1492028071/FantasticFour.mp4
#EXTINF:-1, Fantastic Mr. Fox
http://vod1.freeddns.org:80/13774202158/FantasticMrFox.mp4
#EXTINF:-1, Fat City
http://vod3.freeddns.org:80/195181173146/Fat.City.1972.720p.BluRay.x264.YIFY.mp4
#EXTINF:-1, Fatal Attraction
http://vod5.freeddns.org:80/95154195215/boxoffice/FatalAttraction-1987.mp4
#EXTINF:-1, Father Figures
http://vod5.freeddns.org:80/95154195215/boxoffice/FatherFigures-2017.mp4
#EXTINF:-1, Father of the Year
http://vod3.freeddns.org:80/195181164146/FatherOfTheYear.mp4
#EXTINF:-1, Female Fight Club
http://vod3.freeddns.org:80/1492026922/FemaleFightClub.mp4
#EXTINF:-1, Fences
http://vod3.freeddns.org:80/51254199141/Fences.mp4
#EXTINF:-1, FF: 2 Fast 2 Furious
http://vod3.freeddns.org:80/51254199141/fast2003.mp4
#EXTINF:-1, FF: Fast & Furious
http://vod3.freeddns.org:80/51254199141/fast2009.mp4
#EXTINF:-1, FF: Fast & Furious 6
http://vod3.freeddns.org:80/51254199141/fast6.mp4
#EXTINF:-1, FF: Fast Five
http://vod1.freeddns.org:80/13774202158/FastFive.mp4
#EXTINF:-1, FF: The Fast and the Furious
http://vod3.freeddns.org:80/51254199141/fast2001.mp4
#EXTINF:-1, FF: The Fast and the Furious: Tokyo Drift
http://vod3.freeddns.org:80/51254199141/fast2006.mp4
#EXTINF:-1, FF: The Fate of the Furious
http://vod3.freeddns.org:80/51254199141/TheFateoftheFurious.mp4
#EXTINF:-1, Finding Dory
http://vod3.freeddns.org:80/14920271211/findingdory.mp4
#EXTINF:-1, Finding Dory (English subtitles)
http://vod3.freeddns.org:80/51254199141/FindingDory-sub.mp4
#EXTINF:-1, Finding Forrester
http://vod3.freeddns.org:80/195181173146/Finding.Forrester.2000.720p.BluRay.H264.AAC-RARBG.mp4
#EXTINF:-1, Finding Neverland
http://vod3.freeddns.org:80/519682224/FindingNeverland-2004.mp4
#EXTINF:-1, Fire Down Below
http://vod3.freeddns.org:80/195181173146/movies/FireDownBelow.mp4
#EXTINF:-1, Fire in Paradise
http://vod3.freeddns.org:80/195181173146/Fire.in.Paradise.2019.720p.NF.WEB-DL.DDP5.1.x264-NTG.mp4
#EXTINF:-1, Firepower
http://vod3.freeddns.org:80/195181173146/Firepower.1979.1080p.BluRay.H264.AAC-RARBG.mp4
#EXTINF:-1, First Kill
http://vod3.freeddns.org:80/195181164146/FirstKill.mp4
#EXTINF:-1, First Man
http://vod3.freeddns.org:80/145239129162/FirstMan.mp4
#EXTINF:-1, First Position
http://vod3.freeddns.org:80/217182164138/FirstPosition.mp4
#EXTINF:-1, First Reformed
http://vod5.freeddns.org:80/95154195215/boxoffice/FirstReformed-2017.mp4
#EXTINF:-1, Fish Tank
http://vod1.freeddns.org:80/519692115/FishTank.mp4
#EXTINF:-1, Fist Fight
http://vod1.freeddns.org:80/1518018170/fistfight.mp4
#EXTINF:-1, Fittest On Earth: A Decade Of Fitness
http://vod3.freeddns.org:80/14920271211/fittestonearth.mp4
#EXTINF:-1, Five Feet Apart
http://vod3.freeddns.org:80/14920266145/Five.Feet.Apart.2019.1080p.WEB-DL.DD5.1.H264-FGT.mp4
#EXTINF:-1, Flash Gordon
http://vod3.freeddns.org:80/1492026922/flashgordon.mp4
#EXTINF:-1, Flashdance
http://vod3.freeddns.org:80/195181173146/movies/Flashdance-1983.mp4
#EXTINF:-1, Flight
http://vod3.freeddns.org:80/195181173146/movies/Flight-2012.mp4
#EXTINF:-1, Flight of the Navigator
http://vod1.freeddns.org:80/13774202158/FlightNavigator.mp4
#EXTINF:-1, Flipper
http://vod3.freeddns.org:80/51254199141/flipper.mp4
#EXTINF:-1, Floyd Mayweather Jr. vs Conor McGregor PPV Boxing 2017.08.27
http://vod3.freeddns.org:80/195181164146/mayweathermcgregor-s01e03.mp4
#EXTINF:-1, Floyd Mayweather v Manny Pacquiao
http://vod1.freeddns.org:80/148251187141/MayPac.mp4
#EXTINF:-1, Floyd Mayweather vs Canelo Alvarez 14/09/13
http://vod1.freeddns.org:80/1518018170/floydcanelo.mp4
#EXTINF:-1, Floyd Mayweather vs Miguel Cotto 05/05/12
http://vod3.freeddns.org:80/14920271211/floydcotto.mp4
#EXTINF:-1, Floyd Mayweather vs Oscar De La Hoya 05/05/07
http://vod3.freeddns.org:80/14920271211/mayweatherdelahoya.mp4
#EXTINF:-1, Floyd Mayweather vs.Andre Berto Full Event
http://vod3.freeddns.org:80/151809610/FloydBerto.mp4
#EXTINF:-1, Avatar Way of Water
http://hd4.dlmania.com/Hollywood/Avatar%20-%20The%20Way%20of%20Water%20-%20BRRip/Avatar%20-%20The%20Way%20of%20Water%20-%20BRRip%20HD%20(HDMp4Mania).mp4
#EXTINF:-1, John Wick 4
http://hd1.dlmania.com/Hollywood/John%20Wick%20-%20Chapter%204%20-%20SCam/John%20Wick%20-%20Chapter%204%20-%20SCam%20HD%20(HDMp4Mania).mp4
#EXTINF:-1, Creed 3
http://hd1.dlmania.com/Hollywood/Creed%20III%20-%20BRRip/Creed%20III%20-%20BRRip%20HD%20(HDMp4Mania).mp4
#EXTINF:-1, Shazam - Fury of the Gods
http://hd1.dlmania.com/Hollywood/Shazam%20-%20Fury%20of%20the%20Gods%20-%20BRRip/Shazam%20-%20Fury%20of%20the%20Gods%20-%20BRRip%20HD%20(HDMp4Mania).mp4
#EXTINF:-1, The Last Kingdom - Seven Kings Must Die
http://hd2.dlmania.com/Hollywood/The%20Last%20Kingdom%20-%20Seven%20Kings%20Must%20Die%20-%20BRRip/The%20Last%20Kingdom%20-%20Seven%20Kings%20Must%20Die%20-%20BRRip%20HD%20(HDMp4Mania).mp4
#EXTINF:-1, A Few Good Men
http://45.200.133.5:8089/A%20Few%20Good%20Men/movie.mkv
#EXTINF:-1, Lord of Rings1
http://45.200.133.5:8089/The%20Lord%20of%20the%20Rings%20The%20Fellowship%20of%20the%20Ring/movie.mp4
#EXTINF:-1, The Passion of Christ
http://45.200.133.5:8089/The%20Passion%20of%20the%20Christ/movie.mp4
#EXTINF:-1, Godfather
http://45.200.133.5:8089/The%20Godfather/movie.mp4
#EXTINF:-1, Godfather2
http://45.200.133.5:8089/The%20Godfather%20Part%202/movie.mp4
#EXTINF:-1, Godfather3
http://45.200.133.5:8089/The%20Godfather%20Part%203/movie.mp4
#EXTINF:-1, Godfather
https://dl3.3rver.org/cdn2/02/film/1972/The%20Godfather/The.Godfather.1972.720p.BluRay.MkvCage.mkv
#EXTINF:-1, Jurassic World Dominion
http://hd1.dlmania.com/Hollywood/Jurassic%20World%20Dominion%20-%20SCam/Jurassic%20World%20Dominion%20-%20SCam%20HD%20(HDMp4Mania).mp4
#EXTINF:-1, Avatar Way of Water
http://hd1.dlmania.com/Hollywood/Avatar%20-%20The%20Way%20of%20Water%20-%20SCam/Avatar%20-%20The%20Way%20of%20Water%20-%20SCam%20HD%20(HDMp4Mania).mp4
#EXTINF:-1, Ant Man and the Wasp Quantumania
http://hd1.dlmania.com/Hollywood/Ant-Man%20and%20the%20Wasp%20-%20Quantumania%20-%20SCam/Ant-Man%20and%20the%20Wasp%20-%20Quantumania%20-%20SCam%20HD%20(HDMp4Mania).mp4
#EXTINF:-1, HOBBIT Five Armies
https://cloclo50.cloud.mail.ru/videowl/0p/ZGRldy9WZ1djQ3NXamUvMzI1MDQubWt2.m3u8?double_encode=1
#EXTINF:-1, Black Panther 2
https://cloclo60.cloud.mail.ru/videowl/0p/R0x1OS84b2M0VnRRR2cvbGlzdC5tcDQ=.m3u8?double_encode=1
#EXTINF:-1, Predator
http://deadlyblogger.com/NewRelease/predator1987.mp4
#EXTINF:-1, Predator 2
http://deadlyblogger.com/NewRelease/predator2.mp4
#EXTINF:-1, Predators
http://deadlyblogger.com/NewRelease/predator2010.mp4
#EXTINF:-1, Avatar
http://deadlyblogger.com/NewRelease/avatar2010.mp4
#EXTINF:-1, Four Brothers (2005)
http://www.deadlyblogger.com/NewRelease/fourb.mp4
#EXTINF:-1, Friday (1995)
http://www.deadlyblogger.com/NewRelease/friday1.mp4
#EXTINF:-1, Friday After Next (2002)
http://www.deadlyblogger.com/NewRelease/friday3.mp4
#EXTINF:-1, I Am Legend (2007)
http://www.deadlyblogger.com/NewRelease/iaml.mp4
#EXTINF:-1, I Robot (2004)
http://www.deadlyblogger.com/NewRelease/irobot.mp4
#EXTINF:-1, Independence Day (1996)
http://www.deadlyblogger.com/NewRelease/indep.mp4
#EXTINF:-1, Juice (1992)
http://www.deadlyblogger.com/NewRelease/juice.mp4
#EXTINF:-1, Man of Steel (2013)*
http://www.deadlyblogger.com/NewRelease/steel.mp4
#EXTINF:-1, Menace II Society (1993)
http://www.deadlyblogger.com/NewRelease/menace2.mp4
#EXTINF:-1, New Jack City (1991)
http://www.deadlyblogger.com/NewRelease/newjack.mp4
#EXTINF:-1, Next Friday (2000)
http://www.deadlyblogger.com/NewRelease/friday2.mp4
#EXTINF:-1, Safe House (2012)
http://www.deadlyblogger.com/NewRelease/safehouse.mp4
#EXTINF:-1, Shaft (1971)
http://www.deadlyblogger.com/NewRelease/shaft1.mp4
#EXTINF:-1, South Central (1992)
http://www.deadlyblogger.com/NewRelease/southcentral.mp4
#EXTINF:-1, Shaft in Africa
https://cloclo21.cloud.mail.ru/videowl/0p/TUVCeS9QS1VRRDRNek0=.m3u8?double_encode=1&amp;amp;amp;amp;amp;amp;amp;amp;amp;amp;amp;amp;amp;amp;x-email=iptvmaster2%25252540gmail.com&amp;amp;amp;amp;amp;amp;amp;amp;amp;amp;amp;amp;amp;amp;rnd=1540603294432
#EXTINF:-1, Shafts Big Score
https://cloclo21.cloud.mail.ru/videowl/0p/N2Y4MS9QNjVTVVBoeDg=.m3u8?double_encode=1&amp;amp;amp;amp;amp;amp;amp;amp;amp;amp;amp;amp;amp;amp;amp;x-email=iptvmaster2%25252540gmail.com&amp;amp;amp;amp;amp;amp;amp;amp;amp;amp;amp;amp;amp;amp;amp;rnd=1540505449143
#EXTINF:-1, UNFORGIVEN
https://cloclo11.cloud.mail.ru/videowl/0p/U1pCQy80VjhIOEpLR1ovVW5mb3JnaXZlbl8lMjgxOTkyJTI5X0JsdVJheSUyMHYyXzcyMHBfJTI4Znptb3ZpZXMubmV0JTI5X2NkYTVjM2U2OWRmNTljZmQzZGZlYTAyZjZhNDI4NmU5Lm1rdg==.m3u8?double_encode=1
#EXTINF:-1, DUNE
https://cloclo11.cloud.mail.ru/videowl/0p/U1pCQy80VjhIOEpLR1ovRHVuZV8xOTg0XyUyODE5ODQlMjlfQmx1UmF5XzcyMHBfJTI4Znptb3ZpZXMubmV0JTI5X2M0ZjMxYWViN2U5YWJmODY1NTMwMzQwMzM5N2M5M2VlLm1rdg==.m3u8?double_encode=1
#EXTINF:-1, Despicable Me (2010)
https://www.moviesyug.net/downloadfile/9863.html
#EXTINF:-1, Despicable Me 2 (2013)
https://www.moviesyug.net/downloadfile/11897.html
#EXTINF:-1, The Raiders of the Lost Ark (1981)
https://www.moviesyug.net/downloadfile/14986.html
#EXTINF:-1, Braveheart
https://www.moviesyug.net/downloadfile/12366.html
#EXTINF:-1, Chris Brown: Triple Threat
https://content.uplynk.com/ext/6790c94a453741799d3f3fb3bc9023a4/2534705.m3u8
#EXTINF:-1, American Gangster (2007)
http://www.deadlyblogger.com/NewRelease/agangster.mp4
#EXTINF:-1, Colors (1988)
http://www.deadlyblogger.com/NewRelease/colors.mp4
#EXTINF:-1, Crimson Tide (1995)
http://www.deadlyblogger.com/NewRelease/crimson.mp4
#EXTINF:-1, Doctor Strange (2016)
http://deadlyblogger.com/NewRelease/strange2016.mp4
#EXTINF:-1, Fast & Furious (2009)*
http://www.deadlyblogger.com/NewRelease/fast4.mp4
#EXTINF:-1, Fast Five (2011)*
http://www.deadlyblogger.com/NewRelease/fast5.mp4
#EXTINF:-1, Get on Up (2014)
http://deadlyblogger.com/NewRelease/getonup.mp4
#EXTINF:-1, Home (2009)
https://archive.org/download/Home2009/Home2009_512kb.mp4
#EXTINF:-1, In Too Deep (1999)
http://www.deadlyblogger.com/NewRelease/deep1999.mp4
#EXTINF:-1, Independence Day (1996)
http://www.deadlyblogger.com/NewRelease/indep.mp4
#EXTINF:-1, Iron Man (2008)
http://www.deadlyblogger.com/NewRelease/ironman1.mp4
#EXTINF:-1, Iron Man 2 (2010)
http://www.deadlyblogger.com/NewRelease/ironman2.mp4
#EXTINF:-1, Iron Man 3 (2013)
http://www.deadlyblogger.com/NewRelease/ironman3.mp4
#EXTINF:-1, Jumanji (1995)
http://www.deadlyblogger.com/NewRelease/Jumanji1.mp4
#EXTINF:-1, New Jersey Drive (1995)
http://www.deadlyblogger.com/NewRelease/jerseydrive95.mp4
#EXTINF:-1, Seven Pounds (2008)
http://www.deadlyblogger.com/NewRelease/sevenp.mp4
#EXTINF:-1, Shottas (2002)
http://www.deadlyblogger.com/NewRelease/shottas.mp4
#EXTINF:-1, Star Wars: Episode IV - A New Hope (1977)
http://www.deadlyblogger.com/NewRelease/starwarsiv.mp4
#EXTINF:-1, Star Wars: Episode IV - A New Hope (1977)
http://www.deadlyblogger.com/NewRelease/starwarsiv.mp4
#EXTINF:-1, Star Wars: Episode V - The Empire Strikes Back (1980)
http://www.deadlyblogger.com/NewRelease/starwarsv.mp4
#EXTINF:-1, Star Wars: Episode VI - Return of the Jedi (1983)
http://www.deadlyblogger.com/NewRelease/starwarsvi.mp4
#EXTINF:-1, The Bourne Legacy (2012)
http://www.deadlyblogger.com/NewRelease/bourne4.mp4
#EXTINF:-1, The Bourne Supremacy (2004)
http://www.deadlyblogger.com/NewRelease/bourne2.mp4
#EXTINF:-1, The Bourne Ultimatum (2007)
http://www.deadlyblogger.com/NewRelease/bourne3.mp4
#EXTINF:-1, The Fast and The Furious (1955)
https://archive.org/download/TheFastandtheFuriousJohnIreland1954goofyrip/TheFastandtheFuriousJohnIreland1954goofyrip_512kb.mp4
#EXTINF:-1, The Fast and the Furious (2001)*
http://www.deadlyblogger.com/NewRelease/fast1.mp4
#EXTINF:-1, The Godfather (1972)
http://www.deadlyblogger.com/NewRelease/godfather1.mp4
#EXTINF:-1, The Godfather - Part II (1974)
http://www.deadlyblogger.com/NewRelease/godfather2.mp4
#EXTINF:-1, The Godfather: Part III (1990)
http://www.deadlyblogger.com/NewRelease/godfather3.mp4
#EXTINF:-1, The Hobbit: An Unexpected Journey (2012)
http://www.deadlyblogger.com/NewRelease/hobbit1.mp4
#EXTINF:-1, The Hobbit: The Desolation of Smaug (2013)
http://www.deadlyblogger.com/NewRelease/smaug2013.mp4
#EXTINF:-1, The Last Dragon (1985)
http://www.deadlyblogger.com/NewRelease/lastdragon.mp4
#EXTINF:-1, The Lord of the Rings: The Fellowship of the Ring (2001)
http://www.deadlyblogger.com/NewRelease/fellowship1.mp4
#EXTINF:-1, The Lord of the Rings: The Return of the King (2003)
http://www.deadlyblogger.com/NewRelease/returnking1.mp4
#EXTINF:-1, The Lord of the Rings: The Two Towers (2002)
http://www.deadlyblogger.com/NewRelease/twotowers.mp4
#EXTINF:-1, Transformers (2007)
http://www.deadlyblogger.com/NewRelease/transformers1.mp4
#EXTINF:-1, Transformers: Dark of the Moon (2011)
http://www.deadlyblogger.com/NewRelease/transformers3.mp4
#EXTINF:-1, Transformers: Revenge of the Fallen (2009)
http://www.deadlyblogger.com/NewRelease/transformers2.mp4
#EXTINF:-1, Willow
https://cloclo21.cloud.mail.ru/videowl/0p/TGdBYi9qZEJuMkVOemM=.m3u8?double_encode=1&amp;amp;x-email=iptvmaster2%2540gmail.com&amp;amp;rnd=1554292994252
#EXTINF:-1, Rosewood
https://cloclo21.cloud.mail.ru/videowl/0p/RDluUi90eGVqYk13Rzg=.m3u8?double_encode=1&amp;amp;amp;amp;amp;amp;amp;amp;amp;amp;amp;amp;amp;amp;amp;x-email=iptvmaster2%2540gmail.com&amp;amp;amp;amp;amp;amp;amp;amp;amp;amp;amp;amp;amp;amp;amp;rnd=1548043250533
#EXTINF:-1, Suicide Squad 2
https://cloclo54.cloud.mail.ru/videowl/0p/eU5HSC9oQTgyWHE2OWsvYmYzY2FjNmRlNzhmMjc2Yjc2N2U1NmJhZjZmYWNmNDEtMzYwcC5tcDQ=.m3u8?double_encode=1
#EXTINF:-1, Suicide Squad extended (720)
https://cloclo54.cloud.mail.ru/videowl/0p/eU5HSC9oQTgyWHE2OWsvYmYzY2FjNmRlNzhmMjc2Yjc2N2U1NmJhZjZmYWNmNDEtMzYwcC5tcDQ=.m3u8?double_encode=1
#EXTINF:-1, US | Star Trek
http://stitcher-ipv4.pluto.tv/v1/stitch/embed/hls/channel/5efbd39f8c4ce900075d7698/master.m3u8?deviceType=samsung-tvplus&deviceMake=samsung&deviceModel=samsung&deviceVersion=unknown&appVersion=unknown&deviceLat=0&deviceLon=0&deviceDNT=%7BTARGETOPT%7D&deviceId=%7BPSID%7D&advertisingId=%7BPSID%7D&us_privacy=1YNY&samsung_app_domain=%7BAPP_DOMAIN%7D&samsung_app_name=%7BAPP_NAME%7D&profileLimit=&profileFloor=&embedPartner=samsung-tvplus
#EXTINF:-1, US | Stargate
http://stitcher-ipv4.pluto.tv/v1/stitch/embed/hls/channel/620bfa7df72827000703ddb1/master.m3u8?deviceType=samsung-tvplus&deviceMake=samsung&deviceModel=samsung&deviceVersion=unknown&appVersion=unknown&deviceLat=0&deviceLon=0&deviceDNT=%7BTARGETOPT%7D&deviceId=%7BPSID%7D&advertisingId=%7BPSID%7D&us_privacy=1YNY&samsung_app_domain=%7BAPP_DOMAIN%7D&samsung_app_name=%7BAPP_NAME%7D&profileLimit=&profileFloor=&embedPartner=samsung-tvplus
#EXTINF:-1, The Hobbit 3
https://cloclo57.cloud.mail.ru/videowl/0p/Tmltei82N0pCMlhXdWEvVGhlLkhvYmJpdC5UaGUuQmF0dGxlLm9mLnRoZS5GaXZlLkFybWllcy4yMDE0LjcyMHAubWt2.m3u8?double_encode=1
#EXTINF:-1, Superman
https://cloclo14.cloud.mail.ru/videowl/0p/M2dmai9ieXpqTmZVOFM=.m3u8?double_encode=1
#EXTINF:-1, Terminator Dark Fate
https://cloclo21.cloud.mail.ru/videowl/0p/R253Yi9VTlpmZVlucVo=.m3u8?double_encode=1
#EXTINF:-1, The 13th Warrior
https://cloclo5.cloud.mail.ru/videowl/0p/b3VjVi9pRGVyV2dZRzEvMjNtXzE2MjI5ODI1NDVfNDQ0OS5tcDQ=.m3u8?double_encode=1
#EXTINF:-1, The bad and Ugly
https://cloclo14.cloud.mail.ru/videowl/0p/TG9vRi9IZ1haZXpoZEQ=.m3u8?double_encode=1
#EXTINF:-1, The Client
https://cloclo21.cloud.mail.ru/videowl/0p/OEs3YS9rRE5ZSHVONWo=.m3u8?double_encode=1
#EXTINF:-1, The Fifth Element (1997)
https://archive.org/download/TheFifthElement_201405/The%20Fifth%20Element.mp4
#EXTINF:-1, The Five Heartbeats
https://cloclo50.cloud.mail.ru/videowl/0p/Mm5kNy80R2pVQTc3dkI=.m3u8?double_encode=1
#EXTINF:-1, The Great Debaters
https://cloclo21.cloud.mail.ru/videowl/0p/OGNaNi8xWDgza0p0ZGE=.m3u8?double_encode=1&amp;amp;amp;amp;amp;amp;amp;x-email=iptvmaster2%2540gmail.com&amp;amp;amp;amp;amp;amp;amp;rnd=1551275969447
#EXTINF:-1, The Jackal
https://cloclo14.cloud.mail.ru/videowl/0p/NDdqQS9vbWd6R3ByZnk=.m3u8?double_encode=1
#EXTINF:-1, The Last Don 2 pt1
https://cloclo21.cloud.mail.ru/videowl/0p/QVNHay9wQVFvVm9kU2M=.m3u8?double_encode=1
#EXTINF:-1, The Last Don 2 pt2
https://cloclo5.cloud.mail.ru/videowl/0p/N3djRy9qM2VyaTNNNXU=.m3u8?double_encode=1
#EXTINF:-1, The Last Don pt1
https://cloclo21.cloud.mail.ru/videowl/0p/R1lCUS9OZGNtYWEyYUI=.m3u8?double_encode=1
#EXTINF:-1, The Last Don pt2
https://cloclo21.cloud.mail.ru/videowl/0p/R2Q1aC9OTFY4cU40d2s=.m3u8?double_encode=1
#EXTINF:-1, The Mack
https://cloclo21.cloud.mail.ru/videowl/0p/NDZoNy9NN0x6bWJBS2k=.m3u8?double_encode=1
#EXTINF:-1, Valerian city of 1000 planets
https://cloclo21.cloud.mail.ru/videowl/0p/NEhjeC93QVBSTmRYbTY=.m3u8?double_encode=1&amp;amp;amp;amp;amp;amp;amp;amp;amp;amp;amp;amp;amp;amp;x-email=iptvmaster2%2540gmail.com&amp;amp;amp;amp;amp;amp;amp;amp;amp;amp;amp;amp;amp;amp;rnd=1546286333739
#EXTINF:-1, Whats Love Got to do with it?
https://cloclo21.cloud.mail.ru/videowl/0p/eXZhMi9BNHhDREVZRHo=.m3u8?double_encode=1
#EXTINF:-1, Which Way is Up?
https://cloclo21.cloud.mail.ru/videowl/0p/R2ZnRC9XQ2FWVEg5Q0E=.m3u8?double_encode=1
#EXTINF:-1, 300 empire
https://cloclo21.cloud.mail.ru/videowl/0p/TTF4ay9VRE1EejVvcDM=.m3u8?double_encode=1
#EXTINF:-1, Alexander
https://cloclo57.cloud.mail.ru/videowl/0p/Q1d2Yi9rYnRXbzRoY3MvbWFzdGVyLTEubXA0.m3u8?double_encode=1
#EXTINF:-1, JUMPER
https://cloclo21.cloud.mail.ru/videowl/0p/UkpVSy81SmlEdlBoUWc=.m3u8?double_encode=1
#EXTINF:-1, Shaka Zulu
https://cloclo21.cloud.mail.ru/videowl/0p/dUJ4bi9zYm53NWR4azgveXQxcy5jb20lMjUyMC0lMjUyMFNoYWthJTI1MjBadWx1JTI1MjBUaGUlMjUyMENpdGFkZWwlMjUyMFBhcnQlMjUyMDElMjUyMCUyNTIwRnVsbCUyNTIwTW92aWUlMjUyMGJ5JTI1MjBGaWxtQ2xpcHMubXA0.m3u8?double_encode=1
#EXTINF:-1, The Players Club
https://cloclo21.cloud.mail.ru/videowl/0p/dUJ4bi9zYm53NWR4azgvZ290by5tcDQ=.m3u8?double_encode=1
#EXTINF:-1, TROY
https://cloclo57.cloud.mail.ru/videowl/0p/Q1d2Yi9rYnRXbzRoY3Mvc3QyMl90cm95LWhkLTcyMHAuMTYyNzgwMzEzMC5tcDQ=.m3u8?double_encode=1
#EXTINF:-1, Harlem Nights
https://cloclo21.cloud.mail.ru/videowl/0p/RGF3Ry9meTVaRnIycjU=.m3u8?double_encode=1
#EXTINF:-1, Richard Pryor Here and Now
https://cloclo21.cloud.mail.ru/videowl/0p/OUNQRC9SNFB3Y0JLVkE=.m3u8?double_encode=1&amp;amp;x-email=iptvmaster2%25252540gmail.com&amp;amp;rnd=1540508793841
#EXTINF:-1, BBC Life - s01e08 Creatures of the Deep (2009)
https://archive.org/download/LifeBBCDocumentry2009720pH264/BBC.Life.s01e08.Creatures.of.the.Deep.2009.HDTV.720p.x264.AC3.mp4
#EXTINF:-1, BBC Life - s01e06 Insects (2009)
https://archive.org/download/LifeBBCDocumentry2009720pH264/BBC.Life.s01e06.Insects.2009.HDTV.720p.x264.AC3.mp4
#EXTINF:-1, BBC Life - s01e03 Mammals (2009)
https://archive.org/download/LifeBBCDocumentry2009720pH264/BBC.Life.s01e03.Mammals.2009.HDTV.720p.x264.AC3.mp4
#EXTINF:-1, BBC Life - s01e02 Reptiles and Amphibians (2009)
https://archive.org/download/LifeBBCDocumentry2009720pH264/BBC.Life.s01e02.Reptiles.And.Amphibians.2009.HDTV.720p.x264.AC3.mp4
#EXTINF:-1, SOLO Star Wars
https://cloclo21.cloud.mail.ru/videowl/0p/NVZHOC9zRHByQ0UyZzQ=.m3u8?double_encode=1&amp;amp;x-email=iptvmaster2%2540gmail.com&amp;amp;rnd=1546285985755
#EXTINF:-1, Valerian city of 1000 planets
https://cloclo21.cloud.mail.ru/videowl/0p/NEhjeC93QVBSTmRYbTY=.m3u8?double_encode=1&amp;amp;x-email=iptvmaster2%2540gmail.com&amp;amp;rnd=1546286333739
#EXTINF:-1, Willow
https://cloclo21.cloud.mail.ru/videowl/0p/TGdBYi9qZEJuMkVOemM=.m3u8?double_encode=1&amp;amp;x-email=iptvmaster2%2540gmail.com&amp;amp;rnd=1554292994252
#EXTINF:-1, Frozen 2
https://cloclo21.cloud.mail.ru/videowl/0p/OHhwRS9CaUw2aG1WS2c=.m3u8?double_encode=1
#EXTINF:-1, Merlin PT1
https://cloclo21.cloud.mail.ru/videowl/0p/S1ZUUy9FZ3NVR3c4Vjc=.m3u8?double_encode=1
#EXTINF:-1, Merlin PT2
https://cloclo21.cloud.mail.ru/videowl/0p/QkFlcS9VVWJvb282TU4=.m3u8?double_encode=1
#EXTINF:-1, Mission Impossible (1996)
https://cloclo21.cloud.mail.ru/videowl/0p/RXRvVS9iYW85ZU5FcXo=.m3u8?double_encode=1
#EXTINF:-1, Mission Impossible Ghost Protocol
https://cloclo21.cloud.mail.ru/videowl/0p/RVVwSy80ZktaaTRlWHE=.m3u8?double_encode=1
#EXTINF:-1, Young Guns
https://cloclo13.cloud.mail.ru/videowl/0p/NTZOai9Hc0g5QnVGRXo=.m3u8?double_encode=1&amp;amp;x-email=iptvmaster2%2540gmail.com&amp;amp;rnd=1553300189651
#EXTINF:-1, Firefox
https://cloclo21.cloud.mail.ru/videowl/0p/RDNKQi9DTjVkV1FmeWc=.m3u8?double_encode=1&amp;amp;x-email=iptvmaster2%2540gmail.com&amp;amp;rnd=1548680899676
#EXTINF:-1, Waist Deep
https://cloclo21.cloud.mail.ru/videowl/0p/TE40NS9peE5EUlVqOEg=.m3u8?double_encode=1
#EXTINF:-1, Dark Pheonix (720)
https://cloclo21.cloud.mail.ru/videowl/0p/RFFiYy82ZGhLU3p4MVY=.m3u8?double_encode=1
#EXTINF:-1, The Mack
https://cloclo21.cloud.mail.ru/videowl/0p/NDZoNy9NN0x6bWJBS2k=.m3u8?double_encode=1
#EXTINF:-1, Nat Geo Wild Lions (2018)
https://cloclo21.cloud.mail.ru/videowl/0p/QWpDei9zcGtQdFhTS0Q=.m3u8?double_encode=1
#EXTINF:-1, Jackie Brown
https://cloclo14.cloud.mail.ru/videowl/0p/QUU0dy9KUFZYWUJYdEI=.m3u8?double_encode=1
#EXTINF:-1, RIDDICK
https://cloclo21.cloud.mail.ru/videowl/0p/RDE1MS9lZXhMd2Rxc0U=.m3u8?double_encode=1
#EXTINF:-1, Snatch
https://cloclo21.cloud.mail.ru/videowl/0p/S0tKVi9LcnBHUUJUV1M=.m3u8?double_encode=1
#EXTINF:-1, Beverly Hills Cop 2
https://cloclo21.cloud.mail.ru/videowl/0p/Q1FCNy9MbndSaENVaTU=.m3u8?double_encode=1
#EXTINF:-1, Cradle 2 the Grave
https://cloclo21.cloud.mail.ru/videowl/0p/QU51dC8zaHRLTVROd3E=.m3u8?double_encode=1
#EXTINF:-1, Octopussy
https://cloclo11.cloud.mail.ru/videowl/0p/MTVvai84blVwcW1wZkY=.m3u8?double_encode=1
#EXTINF:-1, Next Avengers
https://cloclo21.cloud.mail.ru/videowl/0p/NWUxcC9yd0Rqa1dqNjU=.m3u8?double_encode=1
#EXTINF:-1, Maverick
https://cloclo11.cloud.mail.ru/videowl/0p/QlJaUC93MVZqRXdpSHk=.m3u8?double_encode=1
#EXTINF:-1, The Outlaw Josey Wells
https://cloclo11.cloud.mail.ru/videowl/0p/N0JmMy9oU3Q3R3htOUE=.m3u8?double_encode=1
#EXTINF:-1, Journey to the Center of Earth
https://cloclo21.cloud.mail.ru/videowl/0p/Mkp2SC9STjd6QmplaTY=.m3u8?double_encode=1
#EXTINF:-1, Clear and Present Danger
https://cloclo14.cloud.mail.ru/videowl/0p/MlZ3dy83QXJYcTJDaVE=.m3u8?double_encode=1
#EXTINF:-1, Ultimate Avengers
https://cloclo1.cloud.mail.ru/videowl/0p/TWRQRy9RNXN5aFlzemE=.m3u8?double_encode=1
#EXTINF:-1, Dark Pheonix
https://cloclo14.cloud.mail.ru/videowl/0p/N1lXUy9hWHlCcHVNVkc=.m3u8?double_encode=1
#EXTINF:-1, Richard Pryor Sunset Strip
https://cloclo21.cloud.mail.ru/videowl/0p/QTdUWC84TmN2aG1Hc1o=.m3u8?double_encode=1&amp;amp;x-email=iptvmaster2%25252540gmail.com&amp;amp;rnd=1540505561796
#EXTINF:-1, Richard Pryor Here and Now
https://cloclo21.cloud.mail.ru/videowl/0p/OUNQRC9SNFB3Y0JLVkE=.m3u8?double_encode=1&amp;amp;x-email=iptvmaster2%25252540gmail.com&amp;amp;rnd=1540508793841
#EXTINF:-1, Ultimate Avengers 2
https://cloclo4.cloud.mail.ru/videowl/0p/RXdhVi9qUjVlRmlhMnI=.m3u8?double_encode=1&amp;amp;x-email=iptvmaster2%2540gmail.com&amp;amp;rnd=1551137255606
#EXTINF:-1, Jet Li The Legend 2
https://cloclo21.cloud.mail.ru/videowl/0p/NVVpTS9ZZ3RYWDZFdlo=.m3u8?double_encode=1&amp;amp;x-email=iptvmaster2%25252540gmail.com&amp;amp;rnd=1540762607364
#EXTINF:-1, Jet Li The Legend
https://cloclo21.cloud.mail.ru/videowl/0p/SzFRMS9CNXFFR2E4c0w=.m3u8?double_encode=1&amp;amp;x-email=iptvmaster2%25252540gmail.com&amp;amp;rnd=1541213680162
#EXTINF:-1, Justice League the Fatal Five
https://cloclo21.cloud.mail.ru/videowl/0p/R2lteS9ZRmpFejJqN2c=.m3u8?double_encode=1&amp;amp;x-email=iptvmaster2%2540gmail.com&amp;amp;rnd=1554293070671
#EXTINF:-1, Jackson 5 live performance
https://cloclo21.cloud.mail.ru/videowl/0p/MlVUQS96WGR3QVdrejg=.m3u8?double_encode=1&amp;amp;x-email=iptvmaster2%2540gmail.com&amp;amp;rnd=1547401639181
#EXTINF:-1, The Last Airbender
https://cloclo21.cloud.mail.ru/videowl/0p/Q2ZDcy9yeTNETlgzeHg=.m3u8?double_encode=1&amp;amp;x-email=iptvmaster2%2540gmail.com&amp;amp;rnd=1549735191394
#EXTINF:-1, Red Tails
https://cloclo21.cloud.mail.ru/videowl/0p/Q0VxbS83a2tnYkJiREE=.m3u8?double_encode=1&amp;amp;x-email=iptvmaster2%252540gmail.com&amp;amp;rnd=1541724171090
#EXTINF:-1, The Firm (2009)
http://vod3.freeddns.org:80/195181164146/thefirm.mp4
#EXTINF:-1, Magic Mike XXL
http://vod3.freeddns.org:80/151809610/MagicMikeXXL.mp4
#EXTINF:-1, Martin Lawrence Doin Time
http://vod1.freeddns.org:80/1518018170/dointime.mp4
#EXTINF:-1, Mississippi Burning
http://vod3.freeddns.org:80/51254199141/mississippiburning.mp4
#EXTINF:-1, WarGames
http://vod3.freeddns.org:80/519682224/wargames.mp4
#EXTINF:-1, Warlock II: The Armageddon
http://vod3.freeddns.org:80/195181173146/movies/Warlock2-1993.mp4
#EXTINF:-1, Warlock III: The End of Innocence
http://vod3.freeddns.org:80/195181173146/movies/Warlock3-1999.mp4
#EXTINF:-1, White Men Can\t Jump
http://vod1.freeddns.org:80/519692115/whitemen.mp4
#EXTINF:-1, Wild Wild West
http://vod3.freeddns.org:80/195181164146/WildWildWest.mp4
#EXTINF:-1, Witchcraft
http://vod3.freeddns.org:80/195181173146/Witchcraft.1964.720p.WEBRip.x264-RARBG.mp4
#EXTINF:-1, Wonder Woman: Bloodlines
http://vod3.freeddns.org:80/195181173146/kids/WonderWomanBloodlines-2019.mp4
#EXTINF:-1, Lord of the Rings Two Towers
https://cloclo21.cloud.mail.ru/videowl/0p/NUpNVi81YXVSSmtidjU=.m3u8?double_encode=1
#EXTINF:-1, Lord of the Rings Return of the King
https://cloclo21.cloud.mail.ru/videowl/0p/QThIay9aV2JBY1RHUWo=.m3u8?double_encode=1
#EXTINF:-1, Creatures of the Deep (2009)
https://archive.org/download/LifeBBCDocumentry2009720pH264/BBC.Life.s01e08.Creatures.of.the.Deep.2009.HDTV.720p.x264.AC3.mp4
#EXTINF:-1, BBC Life - s01e10 Primates (2009)
https://archive.org/download/LifeBBCDocumentry2009720pH264/BBC.Life.s01e10.Primats.2009.HDTV.720p.x264.AC3.mp4
#EXTINF:-1, BBC Life - s01e09 Plants (2009)
https://archive.org/download/LifeBBCDocumentry2009720pH264/BBC.Life.s01e09.Plants.2009.HDTV.720p.x264.AC3.mp4
#EXTINF:-1, BBC Life - s01e08 Creatures of the Deep (2009)
https://archive.org/download/LifeBBCDocumentry2009720pH264/BBC.Life.s01e08.Creatures.of.the.Deep.2009.HDTV.720p.x264.AC3.mp4
#EXTINF:-1, BBC Life - s01e07 Hunters and Hunted (2009)
https://archive.org/download/LifeBBCDocumentry2009720pH264/BBC.Life.s01e07.Hunters.And.Hunted.2009.HDTV.720p.x264.AC3.mp4
#EXTINF:-1, Jet Li The Legend
https://cloclo21.cloud.mail.ru/videowl/0p/NVVpTS9ZZ3RYWDZFdlo=.m3u8?double_encode=1&x-email=iptvmaster2%252540gmail.com&rnd=1540762607364
#EXTINF:-1, Lord of the Rings
https://cloclo57.cloud.mail.ru/videowl/0p/Tmltei82N0pCMlhXdWEvVGhlX0xvcmRfb2ZfdGhlX1JpbmdzX19UaGVfRmVsbG93c2hpcF9vZl90aGVfUmluZ18lMjgyMDAxJTI5X0JsdVJheSUyMHYyXzcyMHBfJTI4Znptb3ZpZXMubmV0JTI5XzU2MzIxOTQ3MDE0OGEyNTc0NjM3Y2MzNGJhY2FjZjRmLm1rdg==.m3u8?double_encode=1
#EXTINF:-1, Clash of the Titans(1981)
https://cloclo21.cloud.mail.ru/videowl/0p/azRlYy9wTDZMdHF1Wk4=.m3u8?double_encode=1
#EXTINF:-1, Farscape Peacekeeper Wars 1
https://cloclo21.cloud.mail.ru/videowl/0p/Smljby9pWHZpbjJDc1E=.m3u8?double_encode=1
#EXTINF:-1, Farscape Peacekeeper Wars 2
https://cloclo21.cloud.mail.ru/videowl/0p/RUxuUC9zZ2ttb1c3NFI=.m3u8?double_encode=1
#EXTINF:-1, Firefox
https://cloclo21.cloud.mail.ru/videowl/0p/RDNKQi9DTjVkV1FmeWc=.m3u8?double_encode=1&amp;amp;amp;amp;amp;amp;amp;amp;amp;amp;amp;amp;amp;amp;x-email=iptvmaster2%2540gmail.com&amp;amp;amp;amp;amp;amp;amp;amp;amp;amp;amp;amp;amp;amp;rnd=1548680899676
#EXTINF:-1, Fist of legend
https://cloclo21.cloud.mail.ru/videowl/0p/NDd4ay9zdnV0b2gxUkg=.m3u8?double_encode=1
#EXTINF:-1, HERO
https://cloclo61.cloud.mail.ru/videowl/0p/VWlBTS9ZdEhia1RIRkYvSU1HXzIyNzcubXA0.m3u8?double_encode=1
#EXTINF:-1, Idlewild
https://cloclo21.cloud.mail.ru/videowl/0p/SDdwQy9EbmhjOUM4eng=.m3u8?double_encode=1&amp;amp;amp;amp;amp;amp;amp;amp;amp;amp;amp;amp;amp;x-email=iptvmaster2%252540gmail.com&amp;amp;amp;amp;amp;amp;amp;amp;amp;amp;amp;amp;amp;rnd=1541724034202
#EXTINF:-1, Incredibles
https://cloclo21.cloud.mail.ru/videowl/0p/NHd4aC90aUxwdWNEcVk=.m3u8?double_encode=1
#EXTINF:-1, Incredibles Auntie Edna
https://cloclo13.cloud.mail.ru/videowl/0p/Rlc4Qi9HNWZjQkRTS3A=.m3u8?double_encode=1
#EXTINF:-1, Indiana Jones Temple of Doom
https://cloclo53.cloud.mail.ru/videowl/0p/N1MxVS9pUnF5aW5CMkMvSW5kaWFuYV9Kb25lc19hbmRfdGhlX1RlbXBsZV9vZl9Eb29tXyUyODE5ODQlMjlfQmx1UmF5X2hpZ2hfJTI4Znptb3ZpZXMubmV0JTI5X2VlYmEzYzA2N2E0ZDZjOTRkZjNiYjc5ZmZhNDQ0MmY3Lm1wNA==.m3u8?double_encode=1
#EXTINF:-1, JL Dark Side
https://cloclo52.cloud.mail.ru/videowl/0p/dllQUC9TODN2WUVVaWkvSnVzdGljZS5MZWFndWUuVW5saW1pdGVkLlMwM0UxMy43MjBwLnZrMDA3Lm1rdg==.m3u8?double_encode=1
#EXTINF:-1, JL HEART SOUL
https://cloclo57.cloud.mail.ru/videowl/0p/Ukp2bS9kVE52cHFIenkvV2JmQmRCVWxsaXhaLm1wNA==.m3u8?double_encode=1
#EXTINF:-1, JL HEART SOUL2
https://cloclo57.cloud.mail.ru/videowl/0p/Ukp2bS9kVE52cHFIenkvTXA0dnBsaGhzcFpMLm1wNA==.m3u8?double_encode=1
#EXTINF:-1, JL HUNTERS MOON
https://cloclo57.cloud.mail.ru/videowl/0p/OG80Ri9DaUs0NnBSYTgvQXZCcWNmV1BHc1hRLm1wNA==.m3u8?double_encode=1
#EXTINF:-1, JL Legend if Doom2
https://cloclo52.cloud.mail.ru/videowl/0p/dllQUC9TODN2WUVVaWkvSnVzdGljZS5MZWFndWUuVW5saW1pdGVkLlMwM0UwNS43MjBwLnZrMDA3Lm1rdg==.m3u8?double_encode=1
#EXTINF:-1, JL LEGION OF DOOM
https://cloclo57.cloud.mail.ru/videowl/0p/OG80Ri9DaUs0NnBSYTgvMS5ta3Y=.m3u8?double_encode=1
#EXTINF:-1, JL LEX
https://cloclo52.cloud.mail.ru/videowl/0p/dllQUC9TODN2WUVVaWkvSnVzdGljZS5MZWFndWUuVW5saW1pdGVkLlMwM0UwMS43MmQudmswMDctMS5ta3Y=.m3u8?double_encode=1
#EXTINF:-1, JL LEX Legend of Doom
https://cloclo52.cloud.mail.ru/videowl/0p/dllQUC9TODN2WUVVaWkvSnVzdGljZS5MZWFndWUuVW5saW1pdGVkLlMwM0UwOC43MjBwLnZrMDA3Lm1rdg==.m3u8?double_encode=1
#EXTINF:-1, JL Mantis
https://cloclo52.cloud.mail.ru/videowl/0p/dllQUC9TODN2WUVVaWkvSnVzdGljZS5MZWFndWUuVW5saW1pdGVkLlMwMkUwOS43MjBwLnZrMDA3Lm1rdg==.m3u8?double_encode=1
#EXTINF:-1, JL Red Skull
https://cloclo52.cloud.mail.ru/videowl/0p/dllQUC9TODN2WUVVaWkvSnVzdGljZS5MZWFndWUuVW5saW1pdGVkLlMwM0UwNy43MjBwLnZrMDA3Lm1rdg==.m3u8?double_encode=1
#EXTINF:-1, JL SHADOW OF HAWK
https://cloclo57.cloud.mail.ru/videowl/0p/OG80Ri9DaUs0NnBSYTgvMi5ta3Y=.m3u8?double_encode=1
#EXTINF:-1, JL STARCROSSED
https://cloclo57.cloud.mail.ru/videowl/0p/Ukp2bS9kVE52cHFIenkvMjAxMi0xMS0wNyUyMDIzLjU1LjU4Lm1wNA==.m3u8?double_encode=1
#EXTINF:-1, JL STARCROSSED2
https://cloclo57.cloud.mail.ru/videowl/0p/Ukp2bS9kVE52cHFIenkvMjAxMi0xMS0wNyUyMDIzLjU3LjU3Lm1wNA==.m3u8?double_encode=1
#EXTINF:-1, JL STARCROSSED3
https://cloclo57.cloud.mail.ru/videowl/0p/Ukp2bS9kVE52cHFIenkvMjAxMi0xMS0wNyUyMDIzLjU4LjExLm1wNA==.m3u8?double_encode=1
#EXTINF:-1, JL STARGIRL
https://cloclo57.cloud.mail.ru/videowl/0p/OG80Ri9DaUs0NnBSYTgvMy5ta3Y=.m3u8?double_encode=1
#EXTINF:-1, JL Stargirl
https://cloclo52.cloud.mail.ru/videowl/0p/dllQUC9TODN2WUVVaWkvSnVzdGljZS5MZWFndWUuVW5saW1pdGVkLlMwM0UwMy43MjBwLnZrMDA3Lm1rdg==.m3u8?double_encode=1
#EXTINF:-1, JL VIKING SHIP
https://cloclo57.cloud.mail.ru/videowl/0p/OG80Ri9DaUs0NnBSYTgvNC5ta3Y=.m3u8?double_encode=1
#EXTINF:-1, JL Wonder Woman
https://cloclo52.cloud.mail.ru/videowl/0p/dllQUC9TODN2WUVVaWkvSnVzdGljZS5MZWFndWUuVW5saW1pdGVkLlMwM0UwNC43MjBwLnZrMDA3Lm1rdg==.m3u8?double_encode=1
#EXTINF:-1, Oceans11
https://cloclo61.cloud.mail.ru/videowl/0p/VWlBTS9ZdEhia1RIRkYvc3QyMl9vY2VhbnMtZWxldmVuLXNkLjE2Mjg3ODE3ODQubXA0.m3u8?double_encode=1
#EXTINF:-1, Once Upon a Time in Hollywood
https://cloclo5.cloud.mail.ru/videowl/0p/MlljMi9YZEYxeHZOaGQ=.m3u8?double_encode=1
#EXTINF:-1, Outlaw Josey Wells
https://cloclo53.cloud.mail.ru/videowl/0p/N1MxVS9pUnF5aW5CMkMvVGhlX091dGxhd19Kb3NleV9XYWxlc18xOTc2XyUyODE5NzYlMjlfQmx1UmF5X2hpZ2hfJTI4Znptb3ZpZXMubmV0JTI5X2IwNDM5MzI4MDAyY2NjNzAxMGVhYzY3ZWM4YjE3ZDRmLTMubXA0.m3u8?double_encode=1
#EXTINF:-1, Percy Jackson Sea of Monsters
https://cloclo61.cloud.mail.ru/videowl/0p/VWlBTS9ZdEhia1RIRkYvc3QyMl9wZXJjeS1qYWNrc29uLXNlYS1vZi1tb25zdGVycy1oZC03MjBwLjE2Mjg3ODM0MzAubXA0.m3u8?double_encode=1
#EXTINF:-1, Superman
https://cloclo14.cloud.mail.ru/videowl/0p/M2dmai9ieXpqTmZVOFM=.m3u8?double_encode=1
#EXTINF:-1, Terminator Dark Fate
https://cloclo21.cloud.mail.ru/videowl/0p/R253Yi9VTlpmZVlucVo=.m3u8?double_encode=1
#EXTINF:-1, The 13th Warrior
https://cloclo5.cloud.mail.ru/videowl/0p/b3VjVi9pRGVyV2dZRzEvMjNtXzE2MjI5ODI1NDVfNDQ0OS5tcDQ=.m3u8?double_encode=1
#EXTINF:-1, The bad and Ugly
https://cloclo14.cloud.mail.ru/videowl/0p/TG9vRi9IZ1haZXpoZEQ=.m3u8?double_encode=1
#EXTINF:-1, The Chronicles of RIDDICK
https://cloclo1.cloud.mail.ru/videowl/0p/M3RBRy83RWNTdTRBeEQ=.m3u8?double_encode=1
#EXTINF:-1, The Fifth Element
https://cloclo21.cloud.mail.ru/videowl/0p/M3hCMS9NeGk0REtTTnk=.m3u8?double_encode=1
#EXTINF:-1, The Fifth Element (1997)
https://archive.org/download/TheFifthElement_201405/The%20Fifth%20Element.mp4
#EXTINF:-1, The Five Heartbeats
https://cloclo50.cloud.mail.ru/videowl/0p/Mm5kNy80R2pVQTc3dkI=.m3u8?double_encode=1
#EXTINF:-1, The Jackal
https://cloclo14.cloud.mail.ru/videowl/0p/NDdqQS9vbWd6R3ByZnk=.m3u8?double_encode=1
#EXTINF:-1, Valerian city of 1000 planets
https://cloclo21.cloud.mail.ru/videowl/0p/NEhjeC93QVBSTmRYbTY=.m3u8?double_encode=1&amp;amp;amp;amp;amp;amp;amp;amp;amp;amp;amp;amp;amp;amp;x-email=iptvmaster2%2540gmail.com&amp;amp;amp;amp;amp;amp;amp;amp;amp;amp;amp;amp;amp;amp;rnd=1546286333739
#EXTINF:-1, Whats Love Got to do with it?
https://cloclo1.cloud.mail.ru/videowl/0p/eXZhMi9BNHhDREVZRHo=.m3u8?double_encode=1
#EXTINF:-1, Which Way is Up?
https://cloclo21.cloud.mail.ru/videowl/0p/R2ZnRC9XQ2FWVEg5Q0E=.m3u8?double_encode=1
#EXTINF:-1, Alexander
https://cloclo57.cloud.mail.ru/videowl/0p/Q1d2Yi9rYnRXbzRoY3MvbWFzdGVyLTEubXA0.m3u8?double_encode=1
#EXTINF:-1, JUMPER
https://cloclo21.cloud.mail.ru/videowl/0p/UkpVSy81SmlEdlBoUWc=.m3u8?double_encode=1
#EXTINF:-1, Harlem Nights
https://cloclo21.cloud.mail.ru/videowl/0p/RGF3Ry9meTVaRnIycjU=.m3u8?double_encode=1
#EXTINF:-1, Mo Better Blues
https://cloclo21.cloud.mail.ru/videowl/0p/NXRyai9HNVp1NXJvZ1g=.m3u8?double_encode=1
#EXTINF:-1, Harriet
https://cloclo21.cloud.mail.ru/videowl/0p/RTl2Ry9kd0JKdFFVeWg=.m3u8?double_encode=1
#EXTINF:-1, Young Guns
https://cloclo13.cloud.mail.ru/videowl/0p/NTZOai9Hc0g5QnVGRXo=.m3u8?double_encode=1&amp;amp;x-email=iptvmaster2%2540gmail.com&amp;amp;rnd=1553300189651
#EXTINF:-1, Harlem Nights
https://cloclo21.cloud.mail.ru/videowl/0p/RGF3Ry9meTVaRnIycjU=.m3u8?double_encode=1
#EXTINF:-1, Waist Deep
https://cloclo21.cloud.mail.ru/videowl/0p/TE40NS9peE5EUlVqOEg=.m3u8?double_encode=1
#EXTINF:-1, RIDDICK
https://cloclo21.cloud.mail.ru/videowl/0p/RDE1MS9lZXhMd2Rxc0U=.m3u8?double_encode=1
#EXTINF:-1, Snatch
https://cloclo21.cloud.mail.ru/videowl/0p/S0tKVi9LcnBHUUJUV1M=.m3u8?double_encode=1
#EXTINF:-1, Beverly Hills Cop 2
https://cloclo21.cloud.mail.ru/videowl/0p/Q1FCNy9MbndSaENVaTU=.m3u8?double_encode=1
#EXTINF:-1, Cradle 2 the Grave
https://cloclo21.cloud.mail.ru/videowl/0p/QU51dC8zaHRLTVROd3E=.m3u8?double_encode=1
#EXTINF:-1, Benjamin Button
https://cloclo14.cloud.mail.ru/videowl/0p/S2F0Yi9Rd3hpUEJrS2E=.m3u8?double_encode=1
#EXTINF:-1, Stargate
https://cloclo21.cloud.mail.ru/videowl/0p/QUU3dy91YlU4RWtDUVU=.m3u8?double_encode=1
#EXTINF:-1, Next Avengers
https://cloclo21.cloud.mail.ru/videowl/0p/NWUxcC9yd0Rqa1dqNjU=.m3u8?double_encode=1
#EXTINF:-1, Maverick
https://cloclo11.cloud.mail.ru/videowl/0p/QlJaUC93MVZqRXdpSHk=.m3u8?double_encode=1
#EXTINF:-1, The Outlaw Josey Wells
https://cloclo11.cloud.mail.ru/videowl/0p/N0JmMy9oU3Q3R3htOUE=.m3u8?double_encode=1
#EXTINF:-1, The Last Airbender
https://cloclo21.cloud.mail.ru/videowl/0p/Q2ZDcy9yeTNETlgzeHg=.m3u8?double_encode=1&amp;amp;x-email=iptvmaster2%2540gmail.com&amp;amp;rnd=1549735191394
#EXTINF:-1, Chain Reaction
https://cloclo21.cloud.mail.ru/videowl/0p/d3Bxay93a01OTDk3bTYvQ2hhaW5fUmVhY3Rpb25fMTk5Nl8lMjgxOTk2JTI5X0JsdVJheV83MjBwXyUyOGZ6bW92aWVzLm5ldCUyOV9hNjMyMWQxNGNlZTdlOTI5NjdiMDBlYzRhMDA3MGJkNC0xLm1rdg==.m3u8?double_encode=1
#EXTINF:-1, Lethal Weapon 2
https://cloclo55.cloud.mail.ru/videowl/0p/MlFaYi9qR0VpRWRBQXUvTGV0aGFsX1dlYXBvbl8yXyUyODE5ODklMjlfQmx1UmF5RXh0XzcyMHBfJTI4Znptb3ZpZXMubmV0JTI5XzdlNjY4MWJmZWY2MzcwMjZkZDQ1MGVmNzBhNzdiMjMwLm1rdg==.m3u8?double_encode=1
#EXTINF:-1, Alita: Battle Angel
http://195.201.202.85/s24/movies/AlitaBattleAngel-MovieLand.mp4
#EXTINF:-1, Alpha
http://195.201.202.85/r70/ml-content/movie/Alpha1080p-TylerMovieLand.mp4
#EXTINF:-1, Aquaman
http://195.201.202.85/r70/ml-content/movie/AquamanIMAX720p-MovieLand.mp4
#EXTINF:-1, Avengers: Endgame
http://195.201.202.85/r70/ml-content/movie/AvengersEndgame1080p-MovieLand.mp4
#EXTINF:-1, Avengers: Infinity War
http://195.201.202.85/r70/ml-content/movie/AvengersInfinityWar720p-TylerMovieLand.mp4
#EXTINF:-1, Black Panther
http://195.201.202.85/r70/ml-content/movie/BlackPanther720p-TylerMovieLand.mp4
#EXTINF:-1, BLACKkKLANSMAN
http://195.201.202.85/r70/ml-content/movie/Blackkklansman720p-TylerMovieLand.mp4
#EXTINF:-1, Captain Marvel
http://195.201.202.85/r70/ml-content/movie/CaptainMarvel1080p-MovieLand.mp4
#EXTINF:-1, Creed 2
http://195.201.202.85/r70/ml-content/movie/Creed2720p-MovieLand.mp4
#EXTINF:-1, Dark Phoenix
http://195.201.202.85/r70/ml-content/movie/DarkPhoenix1080p-MovieLand.mp4
#EXTINF:-1, Deadwood: The Movie
http://195.201.202.85/r70/ml-content/movie/Deadwood720p-MovieLand.mp4
#EXTINF:-1, Fantastic Beasts: The Crimes of Grindelwald
http://195.201.202.85/r70/ml-content/movie/FBTCofGrindelwald720p-TylerMovieLand.mp4
#EXTINF:-1, Gemini Man
http://195.201.202.85/r70/ml-content/movie/GeminiMan1080pHC-MovieLand.mp4
#EXTINF:-1, John Wick: Chapter 3 – Parabellum
http://195.201.202.85/r70/ml-content/movie/JohnWick3720p-MovieLand.mp4
#EXTINF:-1, Joker
http://195.201.202.85/r70/ml-content/movie/Joker1080pHC-MovieLand.mp4
#EXTINF:-1, Jurassic World: Fallen Kingdom
http://195.201.202.85/r70/ml-content/movie/JurassicWorldFallenKingdomHCV2-TylerMovieLand.mp4
#EXTINF:-1, Men in Black: International
http://195.201.202.85/r70/ml-content/movie/MeninBlackInternational1080p-MovieLand.mp4
#EXTINF:-1, Mission: Impossible - Fallout
http://195.201.202.85/r70/ml-content/movie/MissionImpossibleFallout720pHC-TylerMovieLand.mp4
#EXTINF:-1, Once Upon a Time in Hollywood
http://195.201.202.85/r70/ml-content/movie/OnceUponATimeInHollywood1080p-MovieLand.mp4
#EXTINF:-1, Once Upon a Time in London
http://195.201.202.85/s24/movies/OnceUponATimeInLondon-MovieLand.mp4
#EXTINF:-1, Rambo: Last Blood
http://195.201.202.85/r70/ml-content/movie/RamboLastBlood1080pHC-MovieLand.mp4
#EXTINF:-1, Shaft 3
http://195.201.202.85/r70/ml-content/movie/Shaft1080p-MovieLand.mp4
#EXTINF:-1, Shazam!
http://195.201.202.85/r70/ml-content/movie/Shazam720p-MovieLand.mp4
#EXTINF:-1, Solo: A Star Wars Story
http://195.201.202.85/r70/ml-content/movie/SoloAStarWarsStory720p-TylerMovieLand.mp4
#EXTINF:-1, Spider-Man: Far from Home
http://195.201.202.85/r70/ml-content/movie/SpiderManFarFromHome1080p-MovieLand.mp4
#EXTINF:-1, Star Wars: The Rise of Skywalker
http://195.201.202.85/r70/ml-content/movie/StarWarsTheRiseofSkywalker1080p-MovieLand.mp4
#EXTINF:-1, Toy Story 4
http://195.201.202.85/r70/ml-content/movie/ToyStory4720p-MovieLand.mp4
#EXTINF:-1, 300: Rise of an Empire
http://vod1.freeddns.org:80/13774202158/Rise.mp4
#EXTINF:-1, 8 Mile
http://vod1.freeddns.org:80/1482511210/8MileA.mp4
#EXTINF:-1, The Last Airbender
http://vod1.freeddns.org:80/519692115/TheLastAirbender.mp4
#EXTINF:-1, 3:10 to Yuma
http://vod3.freeddns.org:80/1492028071/310ToYuma.mp4
#EXTINF:-1, 48 Hrs.
http://vod3.freeddns.org:80/519682224/48Hours-1982.mp4
#EXTINF:-1, A Madea Christmas
http://vod3.freeddns.org:80/1492026922/AMadeaChristmas.mp4
#EXTINF:-1, Ace Ventura: Pet Detective
http://vod3.freeddns.org:80/217182172100/PetDick.mp4
#EXTINF:-1, Ace Ventura: When Nature Calls
http://vod3.freeddns.org:80/1492026922/ace.mp4
#EXTINF:-1, After Earth
http://vod1.freeddns.org:80/519692115/afterearth.mp4
#EXTINF:-1, Aladdin
http://vod1.freeddns.org:80/1482511210/Aladdin.mp4
#EXTINF:-1, Another 48 Hrs.
http://vod3.freeddns.org:80/519682224/Another48Hours-1990.mp4
#EXTINF:-1, Astro Kid
http://vod3.freeddns.org:80/14920266145/AstroKid.mp4
#EXTINF:-1, Atlantic Rim: Resurrection
http://vod1.freeddns.org:80/519692115/AtlanticRim-2-Resurrection.mp4
#EXTINF:-1, Atlantis: The Lost Empire
http://vod3.freeddns.org:80/195181173146/Atlantis.The.Lost.Empire.2001.720p.BRrip.x264.GAZ.YIFY.mp4
#EXTINF:-1, Batman & Bill
http://vod3.freeddns.org:80/51254199141/batman&bill.mp4
#EXTINF:-1, Batman & Mr. Freeze: SubZero
http://vod3.freeddns.org:80/1492028071/batman-mrfreezesubzero.mp4
#EXTINF:-1, Batman and Harley Quinn
http://vod3.freeddns.org:80/195181164146/BatmanAndHarleyQuinn.mp4
#EXTINF:-1, Batman Unlimited: Monster Mayhem
http://vod3.freeddns.org:80/151809610/BatmanUn.mp4
#EXTINF:-1, Batman vs. Two-Face
http://vod3.freeddns.org:80/217182164125/BatmanTwoFace.mp4
#EXTINF:-1, Batman: Mystery of the Batwoman
http://vod3.freeddns.org:80/1492028071/batman-mysteryofthebatwoman.mp4
#EXTINF:-1, Beverly Hills Cop
http://vod1.freeddns.org:80/519692115/Beverly.mp4
#EXTINF:-1, Beyonce Lemonade Music Videos
http://vod3.freeddns.org:80/1492028071/Beyoncelemonade.mp4
#EXTINF:-1, Blood Father
http://vod1.freeddns.org:80/1518018170/BloodFather.mp4
#EXTINF:-1, Boogie Nights
http://vod1.freeddns.org:80/519692115/boogienights.mp4
#EXTINF:-1, Bruce Lee Fist of Fury
http://vod3.freeddns.org:80/217182172100/fistoffury.mp4
#EXTINF:-1, Chris Rock: Bigger & Blacker
http://vod1.freeddns.org:80/1518018170/chrisrockbiggerblacker.mp4
#EXTINF:-1, Chris Rock: Tamborine
http://vod3.freeddns.org:80/217182132110/ChrisRockTamborine.mp4
#EXTINF:-1, Clash of the Titans
http://vod3.freeddns.org:80/151809610/ClashOf.mp4
#EXTINF:-1, Coming to America
http://vod1.freeddns.org:80/1482511210/ComingTo.mp4
#EXTINF:-1, Con Air
http://vod1.freeddns.org:80/519692115/conair.mp4
#EXTINF:-1, Conan the Destroyer
http://vod3.freeddns.org:80/217182172100/conandestroyer.mp4
#EXTINF:-1, Dave Chappelle: Deep in the Heart of Texas
http://vod3.freeddns.org:80/195181164146/DaveChappelleDeep.mp4
#EXTINF:-1, Dave Chappelle: Killin\ Them Softly
http://vod1.freeddns.org:80/1518018170/davechappellekillin.mp4
#EXTINF:-1, Dave Chappelle: Sticks & Stones
http://vod3.freeddns.org:80/195181173146/Dave.Chappelle.Sticks.and.Stones.2019.1080p.WEBRip.x264-RARBG.mp4
#EXTINF:-1, Dave Chappelle: The Age of Spin
http://vod3.freeddns.org:80/195181164146/DaveChappelleTheAgeofSpin.mp4
#EXTINF:-1, Dave Chappelle\s Block Party
http://vod3.freeddns.org:80/195181164146/DaveChappelleblockparty.mp4
#EXTINF:-1, Dennis the Menace
http://vod1.freeddns.org:80/1518018170/dennisthemenace.mp4
#EXTINF:-1, Despicable Me
http://vod3.freeddns.org:80/195181173146/DespicableMe.mp4
#EXTINF:-1, Despicable Me 2
http://vod3.freeddns.org:80/195181173146/DespicableMe2.mp4
#EXTINF:-1, Dracula Untold
http://vod1.freeddns.org:80/13774202158/DracUntold.mp4
#EXTINF:-1, Dreamgirls
http://vod1.freeddns.org:80/519692115/Dreamgirls.mp4
#EXTINF:-1, Dumb and Dumber
http://vod1.freeddns.org:80/13774202158/Dumb.mp4
#EXTINF:-1, Dumb and Dumber To
http://vod1.freeddns.org:80/13774202158/Dumb2.mp4
#EXTINF:-1, Flash Gordon
http://vod3.freeddns.org:80/1492026922/flashgordon.mp4
#EXTINF:-1, Focus
http://vod1.freeddns.org:80/1482511210/Focus.mp4
#EXTINF:-1, Ghostbusters II
http://vod3.freeddns.org:80/217182172100/Ghostbusters2.mp4
#EXTINF:-1, Glory
http://vod3.freeddns.org:80/1518026228/Glory.mp4
#EXTINF:-1, Hanna (2011)
http://vod1.freeddns.org:80/95154195215h/movies/Hanna-2011.mp4
#EXTINF:-1, HBO Boxing Mayweather vs Pacquiao Weigh-ins
http://vod1.freeddns.org:80/148251187141/HBOWeigh.mp4
#EXTINF:-1, Hip Hop Evolution Season 2
http://vod3.freeddns.org:80/145239129162/HipHopEvolution-s02e04.mp4
#EXTINF:-1, Jumper
http://vod3.freeddns.org:80/14920266145/Jumper.mp4
#EXTINF:-1, Kung Fu Panda 2
http://vod1.freeddns.org:80/13774202158/KungFuPanda2.mp4
#EXTINF:-1, Kung Fu Season 1
http://vod3.freeddns.org:80/195181173146/series/KungFu-s01e16.mp4
#EXTINF:-1, Kung Fu Season 2
http://vod3.freeddns.org:80/195181173146/series/KungFu-s02e23.mp4
#EXTINF:-1, Kung Fu Season 3
http://vod3.freeddns.org:80/195181173146/series/KungFu-s03e24.mp4
#EXTINF:-1, Shottas
http://vod3.freeddns.org:80/14920271211/shottas.mp4
#EXTINF:-1, Star Trek
http://vod3.freeddns.org:80/1492026922/StarTrek.mp4
#EXTINF:-1, The Cosby Show Season 1
http://vod1.freeddns.org:80/13774202158/series/thecosbyshow-s01e24.mp4
#EXTINF:-1, The Cosby Show Season 2
http://vod1.freeddns.org:80/13774202158/series/thecosbyshow-s02e25.mp4
#EXTINF:-1, The Cosby Show Season 3
http://vod1.freeddns.org:80/13774202158/series/thecosbyshow-s03e25.mp4
#EXTINF:-1, The Cosby Show Season 4
http://vod1.freeddns.org:80/13774202158/series/thecosbyshow-s04e23.mp4
#EXTINF:-1, The Cosby Show Season 5
http://vod1.freeddns.org:80/13774202158/series/thecosbyshow-s05e25.mp4
#EXTINF:-1, The Cosby Show Season 6
http://vod1.freeddns.org:80/13774202158/series/thecosbyshow-s06e26.mp4
#EXTINF:-1, The Cosby Show Season 7
http://vod1.freeddns.org:80/13774202158/series/thecosbyshow-s07e25.mp4
#EXTINF:-1, The Cosby Show Season 8
http://vod1.freeddns.org:80/13774202158/series/thecosbyshow-s08e24.mp4
#EXTINF:-1, Bad Boys (1995)
http://www.deadlyblogger.com/NewRelease/badboys1.mp4
#EXTINF:-1, Bad Boys II (2003)
http://www.deadlyblogger.com/NewRelease/badboys2.mp4
#EXTINF:-1, Boyz n the Hood (1991)
http://www.deadlyblogger.com/NewRelease/thehood.mp4
#EXTINF:-1, Rogue One: A Star Wars Story (2016)
http://deadlyblogger.com/NewRelease/rogue1.mp4
#EXTINF:-1, Shaft (1971)
http://www.deadlyblogger.com/NewRelease/shaft1.mp4
#EXTINF:-1, Shottas (2002)
http://www.deadlyblogger.com/NewRelease/shottas.mp4
#EXTINF:-1, Star Trek: Into Darkness (2013)
http://deadlyblogger.com/NewRelease/darkness.mp4
#EXTINF:-1, Star Wars: Episode V - The Empire Strikes Back (1980)
http://www.deadlyblogger.com/NewRelease/starwarsv.mp4
#EXTINF:-1, Star Wars: Episode VI - Return of the Jedi (1983)
http://www.deadlyblogger.com/NewRelease/starwarsvi.mp4
#EXTINF:-1, The Bourne Legacy (2012)
http://www.deadlyblogger.com/NewRelease/bourne4.mp4
#EXTINF:-1, The Bourne Supremacy (2004)
http://www.deadlyblogger.com/NewRelease/bourne2.mp4
#EXTINF:-1, The Bourne Ultimatum (2007)
http://www.deadlyblogger.com/NewRelease/bourne3.mp4
#EXTINF:-1, The Hobbit: An Unexpected Journey (2012)
http://www.deadlyblogger.com/NewRelease/hobbit1.mp4
#EXTINF:-1, The Hobbit: The Desolation of Smaug (2013)
http://www.deadlyblogger.com/NewRelease/smaug2013.mp4
#EXTINF:-1, After Earth
http://vod1.freeddns.org:80/519692115/afterearth.mp4
#EXTINF:-1, Men in Black (1997)
http://www.deadlyblogger.com/NewRelease/mnb1.mp4
#EXTINF:-1, Men in Black 3 (2012)
http://www.deadlyblogger.com/NewRelease/mnb3.mp4
#EXTINF:-1, Men in Black II (2002)
http://www.deadlyblogger.com/NewRelease/mnb2.mp4
#EXTINF:-1, The Lord of the Rings: The Fellowship of the Ring (2001)
http://www.deadlyblogger.com/NewRelease/fellowship1.mp4
#EXTINF:-1, The Lord of the Rings: The Two Towers (2002)
http://www.deadlyblogger.com/NewRelease/twotowers.mp4
#EXTINF:-1, The Matrix (1999)
http://www.deadlyblogger.com/NewRelease/matrix1.mp4
#EXTINF:-1, The Matrix Reloaded (2003)
http://www.deadlyblogger.com/NewRelease/matrix2.mp4
#EXTINF:-1, The Matrix Revolutions (2003)
http://www.deadlyblogger.com/NewRelease/matrix3.mp4
#EXTINF:-1, 000 BC
http://vod1.freeddns.org:80/519692115/10000BC.mp4
#EXTINF:-1, 3:10 to Yuma
http://vod3.freeddns.org:80/1492028071/310ToYuma.mp4
#EXTINF:-1, A Beautiful Mind
http://vod3.freeddns.org:80/195181164146/BeautifulMind.mp4
#EXTINF:-1, A Madea Christmas
http://vod3.freeddns.org:80/1492026922/AMadeaChristmas.mp4
#EXTINF:-1, Ace Ventura: Pet Detective
http://vod3.freeddns.org:80/217182172100/PetDick.mp4
#EXTINF:-1, Ace Ventura: When Nature Calls
http://vod3.freeddns.org:80/1492026922/ace.mp4
#EXTINF:-1, Adele Live in New York
http://vod3.freeddns.org:80/217182172100/adelelive.mp4
#EXTINF:-1, After Earth
http://vod1.freeddns.org:80/519692115/afterearth.mp4
#EXTINF:-1, Against My Religion (Pretty Dirty) XXX 2017
http://vod3.freeddns.org:80/151809784/xxx/againstmyreligion-s01e04.mp4
#EXTINF:-1, Aladdin
http://vod1.freeddns.org:80/1482511210/Aladdin.mp4
#EXTINF:-1, Along Came a Spider
http://vod1.freeddns.org:80/519692115/alongspider.mp4
#EXTINF:-1, Another 48 Hrs.
http://vod3.freeddns.org:80/519682224/Another48Hours-1990.mp4
#EXTINF:-1, Astro Kid
http://vod3.freeddns.org:80/14920266145/AstroKid.mp4
#EXTINF:-1, Bad Boys
http://vod3.freeddns.org:80/145239129162/old0619/badboys.mp4
#EXTINF:-1, Beyonce Lemonade Music Videos
http://vod3.freeddns.org:80/1492028071/Beyoncelemonade.mp4
#EXTINF:-1, Biggie and Tupac
http://vod3.freeddns.org:80/151809610/Biggie.mp4
#EXTINF:-1, Black Beauty 3: Ride For Life XXX
http://vod3.freeddns.org:80/195181173146/black-beauty-vol-3-720p.mp4
#EXTINF:-1, Black Panthers 3
http://vod1.freeddns.org:80/13774202158/xxx/BlackPanthers3-s01e04.mp4
#EXTINF:-1, Black White 10 Blacked XXX
http://vod3.freeddns.org:80/51254199141/xxx/BlackWhite10-s01e04.mp4
#EXTINF:-1, Blood Father
http://vod1.freeddns.org:80/1518018170/BloodFather.mp4
#EXTINF:-1, Bowfinger
http://vod3.freeddns.org:80/519682224/Bowfinger.mp4
#EXTINF:-1, Central Intelligence
http://vod3.freeddns.org:80/14920271211/centralintell.mp4
#EXTINF:-1, Charlie\s Angels: Full Throttle
http://vod3.freeddns.org:80/195181164146/Charliesangelsfullthrottle.mp4
#EXTINF:-1, Con Air
http://vod1.freeddns.org:80/519692115/conair.mp4
#EXTINF:-1, Dracula Untold
http://vod1.freeddns.org:80/13774202158/DracUntold.mp4
#EXTINF:-1, Dreamgirls
http://vod1.freeddns.org:80/519692115/Dreamgirls.mp4
#EXTINF:-1, Fantastic 4
http://vod3.freeddns.org:80/1492028071/Fantastic4.mp4
#EXTINF:-1, Fantastic 4: Rise of the Silver Surfer
http://vod3.freeddns.org:80/1492028071/Fantastic4Rise.mp4
#EXTINF:-1, Finish In My Ass (Brazzers) XXX 2017
http://vod3.freeddns.org:80/151809784/xxx/finishinmyass-s01e06.mp4
#EXTINF:-1, Friday
http://vod1.freeddns.org:80/1482511210/Friday.mp4
#EXTINF:-1, King Arthur
http://vod3.freeddns.org:80/51254199141/kingarthur.mp4
#EXTINF:-1, Payback
http://vod3.freeddns.org:80/14920271211/payback.mp4
#EXTINF:-1, Peter Pan
http://vod1.freeddns.org:80/1482511210/PeterPan.mp4
#EXTINF:-1, Planet of the Apes (2001)
http://vod1.freeddns.org:80/519692115/planetapes2001.mp4
#EXTINF:-1, Spy Game
http://vod1.freeddns.org:80/519692115/SpyGame.mp4
#EXTINF:-1, Spy Kids 1
http://vod1.freeddns.org:80/519692115/spykids.mp4
#EXTINF:-1, Spy Kids 2: The Island of Lost Dreams
http://vod1.freeddns.org:80/519692115/spykids2.mp4
#EXTINF:-1, Swallows and Amazons
http://vod3.freeddns.org:80/51254199141/SwallowsandAmazons.mp4
#EXTINF:-1, Swordfish
http://vod3.freeddns.org:80/51254199141/Swordfish.mp4
#EXTINF:-1, Taken 2
http://vod1.freeddns.org:80/13774202158/Taken2.mp4
#EXTINF:-1, Terminator 2: Judgment Day
http://vod1.freeddns.org:80/13774202158/Terminator2.mp4
#EXTINF:-1, Terminator 3: Rise of the Machines
http://vod3.freeddns.org:80/217182172100/T3.mp4
#EXTINF:-1, Terminator Salvation
http://vod1.freeddns.org:80/519692115/termsalv.mp4
#EXTINF:-1, Terminator: The Sarah Connor Chronicles Season 1
http://vod3.freeddns.org:80/195181173146/series/TerminatorTheSarahConnorChronicles-s01e09.mp4
#EXTINF:-1, Terminator: The Sarah Connor Chronicles Season 2
http://vod3.freeddns.org:80/195181173146/series/TerminatorTheSarahConnorChronicles-s02e22.mp4
#EXTINF:-1, The 6th Man
http://vod3.freeddns.org:80/195181164146/The6thMan.mp4
#EXTINF:-1, The A-Team
http://vod1.freeddns.org:80/1482511210/ATeam.mp4
#EXTINF:-1, The Addams Family
http://vod1.freeddns.org:80/1518018170/theaddamsfamily.mp4
#EXTINF:-1, The Blue Planet Season 1
http://vod3.freeddns.org:80/151809610/series/theblueplanet-s01e08.mp4
#EXTINF:-1, The Butterfly Effect
http://vod3.freeddns.org:80/195181164146/butterfly.mp4
#EXTINF:-1, The Crocodile Hunter: Collision Course
http://vod1.freeddns.org:80/519692115/TheCrocodileHunter-CollisionCourse.mp4
#EXTINF:-1, Toy Story
http://vod3.freeddns.org:80/195181173146/toystory.mp4
#EXTINF:-1, Zulu
http://vod3.freeddns.org:80/217182172100/Zulu.mp4
#EXTINF:-1, 12 Years a Slave (2013)
http://www.deadlyblogger.com/NewRelease/12slave.mp4
#EXTINF:-1, Bad Boys (1995)
http://www.deadlyblogger.com/NewRelease/badboys1.mp4
#EXTINF:-1, Bad Boys II (2003)
http://www.deadlyblogger.com/NewRelease/badboys2.mp4
#EXTINF:-1, Battle for the Planet of the Apes (1973)
http://www.deadlyblogger.com/NewRelease/apes5.mp4
#EXTINF:-1, Belly (1998)
http://www.deadlyblogger.com/NewRelease/belly1998.mp4
#EXTINF:-1, Beneath the Planet of the Apes (1970)
http://www.deadlyblogger.com/NewRelease/apes2.mp4
#EXTINF:-1, Conquest of the Planet of the Apes (1972)
http://www.deadlyblogger.com/NewRelease/apes4.mp4
#EXTINF:-1, Crimson Tide (1995)
http://www.deadlyblogger.com/NewRelease/crimson.mp4
#EXTINF:-1, Cujo (1983)
http://www.deadlyblogger.com/NewRelease/cujo.mp4
#EXTINF:-1, Deja Vu (2006)
http://www.deadlyblogger.com/NewRelease/dejavu.mp4
#EXTINF:-1, Escape from the Planet of the Apes (1971)
http://www.deadlyblogger.com/NewRelease/apes3.mp4
#EXTINF:-1, Friday (1995)
http://www.deadlyblogger.com/NewRelease/friday1.mp4
#EXTINF:-1, Friday After Next (2002)
http://www.deadlyblogger.com/NewRelease/friday3.mp4
#EXTINF:-1, (500) Days of Summer
http://vod1.freeddns.org:80/13774202158/500Days.mp4
#EXTINF:-1, 4: Apocalypse
http://vod3.freeddns.org:80/195181173146/movies/Rec4-2014.mp4
#EXTINF:-1, 10 Cent Pistol
http://vod3.freeddns.org:80/151809784/10CentPistol.mp4
#EXTINF:-1, 10 Rillington Place
http://vod3.freeddns.org:80/14920271211/10rillingtonplace.mp4
#EXTINF:-1, 100 Metros
http://vod3.freeddns.org:80/1492026922/100metros.mp4
#EXTINF:-1, 100 Streets
http://vod3.freeddns.org:80/151809784/100Streets.mp4
#EXTINF:-1, 100%: Julian Edelman
http://vod3.freeddns.org:80/195181173146/100.per.cent.Julian.Edelman.2019.1080p.WEBRip.x264-RARBG.mp4
#EXTINF:-1, 101 Dalmatians
http://vod3.freeddns.org:80/195181164146/101Dalmatians.mp4
#EXTINF:-1, 102 Minutes That Changed America
http://vod3.freeddns.org:80/217182172100/102Mins.mp4
#EXTINF:-1, 102 Not Out
http://vod3.freeddns.org:80/217182164125/102NotOut.mp4
#EXTINF:-1, 12 Angry Men
http://vod3.freeddns.org:80/195181164146/12AngryMen.mp4
#EXTINF:-1, 12 Rounds 3: Lockdown
http://vod3.freeddns.org:80/51254199141/12Rounds3Lockdown.mp4
#EXTINF:-1, 12 Strong
http://vod5.freeddns.org:80/95154195215/boxoffice/12Strong-2018.mp4
#EXTINF:-1, 12 Wishes of Christmas
http://vod3.freeddns.org:80/195181164146/12WishesOfChristmas2011.mp4
#EXTINF:-1, 12 Years a Slave
http://vod3.freeddns.org:80/195181164146/12YearsASlave.mp4
#EXTINF:-1, 127 Hours
http://vod3.freeddns.org:80/195181164146/127Hours.mp4
#EXTINF:-1, 13 Cameras
http://vod3.freeddns.org:80/51254199141/13cameras.mp4
#EXTINF:-1, 13 Going on 30
http://vod1.freeddns.org:80/519692115/13GoingOn30.mp4
#EXTINF:-1, 13 Hours: The Secret Soldiers of Benghazi
http://vod3.freeddns.org:80/1492028071/13hours.mp4
#EXTINF:-1, 1408
http://vod1.freeddns.org:80/1482511210/1408.mp4
#EXTINF:-1, 16 Blocks
http://vod1.freeddns.org:80/519692115/16Blocks.mp4
#EXTINF:-1, 17 Again
http://vod1.freeddns.org:80/519692115/17Again.mp4
#EXTINF:-1, 1985
http://vod3.freeddns.org:80/145239129162/old0619/1985-2018.mp4
#EXTINF:-1, 1991
http://vod3.freeddns.org:80/195181173146/1991.2018.FRENCH.BDRip.XviD-ACOOL.mp4
#EXTINF:-1, 2 Guns
http://vod3.freeddns.org:80/195181164146/TwoGuns2013.mp4
#EXTINF:-1, 2 States
http://vod3.freeddns.org:80/151809610/2States.mp4
#EXTINF:-1, 2:22
http://vod3.freeddns.org:80/195181164146/222.mp4
#EXTINF:-1, 2010: The Year We Made Contact
http://vod3.freeddns.org:80/195181173146/movies/2010TheYearWeMadeContact-1984.mp4
#EXTINF:-1, 2016 the End
http://vod3.freeddns.org:80/195181173146/2016TheEnd.2017.mp4
#EXTINF:-1, 21 Days Under the Sky
http://vod3.freeddns.org:80/51254199141/21daysunder.mp4
#EXTINF:-1, 24: Redemption
http://vod3.freeddns.org:80/195181173146/series/24Redemption-2008.mp4
#EXTINF:-1, 27 Dresses
http://vod3.freeddns.org:80/195181173146/movies/27Dresses-2008.mp4
#EXTINF:-1, 28 Days Later...
http://vod1.freeddns.org:80/148251187141/28Days.mp4
#EXTINF:-1, 3 Idiots
http://vod3.freeddns.org:80/195181164146/3Idiots.mp4
#EXTINF:-1, 3 Little Pigs and the Magic Lamp
http://vod3.freeddns.org:80/1492026922/3littlepigs.mp4
#EXTINF:-1, 3 Ninjas Knuckle Up
http://vod3.freeddns.org:80/195181173146/movies/3Ninjas3-1995.mp4
#EXTINF:-1, 30 For 30 Nature Boy
http://vod1.freeddns.org:80/519692115/30For30-NatureBoy-s01e02.mp4
#EXTINF:-1, 300: Rise of an Empire
http://vod1.freeddns.org:80/13774202158/Rise.mp4
#EXTINF:-1, 303 Squadron
http://vod3.freeddns.org:80/14920266145/Squadron.303.2018.720p.BluRay.H264.AAC-RARBG.mp4
#EXTINF:-1, 3096 Days
http://vod3.freeddns.org:80/195181173146/movies/3096Days-2013.mp4
#EXTINF:-1, 40 Days and 40 Nights
http://vod1.freeddns.org:80/519692115/40DaysAnd40Nights.mp4
#EXTINF:-1, 45 Years
http://vod3.freeddns.org:80/1492026922/45Years.mp4
#EXTINF:-1, 48 Hrs.
http://vod3.freeddns.org:80/519682224/48Hours-1982.mp4
#EXTINF:-1, 5 Flights Up
http://vod3.freeddns.org:80/51254199141/5FlightsUp.mp4
#EXTINF:-1, 5 Weddings
http://vod3.freeddns.org:80/195181173146/5Weddings.mp4
#EXTINF:-1, 6 Days
http://vod3.freeddns.org:80/519682224/6Days.mp4
#EXTINF:-1, 7 Minutes
http://vod1.freeddns.org:80/1482511210/7minutes.mp4
#EXTINF:-1, 72 Hours: Martyr Who Never Died
http://vod3.freeddns.org:80/195181173146/72Hours.mp4
#EXTINF:-1, 8 Half
http://vod1.freeddns.org:80/148251187141/8Half.mp4
#EXTINF:-1, 8 Mile
http://vod1.freeddns.org:80/1482511210/8MileA.mp4
#EXTINF:-1, 88 Minutes
http://vod1.freeddns.org:80/519692115/88Minutes.mp4
#EXTINF:-1, A Bad Moms Christmas
http://vod3.freeddns.org:80/14920271211/ABadMomsChristmas.mp4
#EXTINF:-1, A Beautiful Mind
http://vod3.freeddns.org:80/195181164146/BeautifulMind.mp4
#EXTINF:-1, A Bridge Too Far (English Subs)
http://vod1.freeddns.org:80/1518018170/ABridgeTooFar.mp4
#EXTINF:-1, A Brilliant Young Mind
http://vod3.freeddns.org:80/151809610/XY.mp4
#EXTINF:-1, A Bug\s Life
http://vod1.freeddns.org:80/13774202158/BugsLife.mp4
#EXTINF:-1, A Charlie Brown Christmas
http://vod1.freeddns.org:80/519692115/CharlieXmas.mp4
#EXTINF:-1, A Christmas Prince: The Royal Wedding
http://vod3.freeddns.org:80/195181173146/A.Christmas.Prince.The.Royal.Wedding.2018.720p.WEBRip.x264-RARBG.mp4
#EXTINF:-1, A Christmas Recipe for Romance
http://vod3.freeddns.org:80/195181173146/A.Christmas.Recipe.for.Romance.2019.1080p.HDTV.x264-CRiMSON.mp4
#EXTINF:-1, A Christmas Star
http://vod3.freeddns.org:80/217182172100/AChristmasStar.mp4
#EXTINF:-1, A Cinderella Story: Christmas Wish
http://vod3.freeddns.org:80/195181173146/A.Cinderella.Story.Christmas.Wish.2019.720p.BluRay.H264.AAC-RARBG.mp4
#EXTINF:-1, A Cinderella Story: If the Shoe Fits
http://vod3.freeddns.org:80/14920266145/ACinderellaStoryIfTheShoeFits-2016.mp4
#EXTINF:-1, A Cinderella Story: Once Upon a Song
http://vod3.freeddns.org:80/14920266145/ACinderellaStoryOnceUponASong-2011.mp4
#EXTINF:-1, A Conspiracy of Faith
http://vod3.freeddns.org:80/1492028071/AConspiracyOfFaith.mp4
#EXTINF:-1, A Cool Fish
http://vod3.freeddns.org:80/195181173146/A.Cool.Fish.2018.CHINESE.1080p.WEBRip.AAC2.0.x264-NOGRP.mp4
#EXTINF:-1, A Cry for Help
http://vod3.freeddns.org:80/145239129162/Acryforhelp.mp4
#EXTINF:-1, A Cure for Wellness
http://vod3.freeddns.org:80/14920271211/acureforwellness.mp4
#EXTINF:-1, A Dandy in Aspic
http://vod3.freeddns.org:80/195181173146/A.Dandy.In.Aspic.1968.720p.BluRay.x264.mp4
#EXTINF:-1, A Dangerous Game
http://vod3.freeddns.org:80/1492026922/adangerousgame.mp4
#EXTINF:-1, A Dark Song
http://vod3.freeddns.org:80/195181164146/ADarkSong.mp4
#EXTINF:-1, A Fish Called Wanda
http://vod3.freeddns.org:80/195181173146/movies/AFishCalledWanda-1988.mp4
#EXTINF:-1, A Fistful of Dollars
http://vod1.freeddns.org:80/1482511210/AFistful.mp4
#EXTINF:-1, A Flying Jatt
http://vod1.freeddns.org:80/1518018170/AFlyingJatt.mp4
#EXTINF:-1, A Frozen Christmas 2
http://vod3.freeddns.org:80/195181173146/a.frozen.christmas.2.2017.dvdrip.x264-spooks.mp4
#EXTINF:-1, A Frozen Christmas 2 (Hindi)
http://vod3.freeddns.org:80/195181173146/AFrozenChristmas2-hindi.mp4
#EXTINF:-1, A Frozen Christmas 3
http://vod5.freeddns.org:80/95154195215/boxoffice2/A.Frozen.Christmas.3.2018.720p.WEBRip.x264.mp4
#EXTINF:-1, A Garfield Christmas Special
http://vod1.freeddns.org:80/519692115/Garfield-AGarfieldChristmasSpecial.mp4
#EXTINF:-1, A Gentleman
http://vod3.freeddns.org:80/195181164146/AGentleman.mp4
#EXTINF:-1, A Ghost of a Chance
http://vod3.freeddns.org:80/195181173146/A.Ghost.Of.A.Chance.2011.JAPANESE.1080p.BluRay.H264.AAC-VXT.mp4
#EXTINF:-1, A Ghost Story
http://vod1.freeddns.org:80/14920220391/AGhostStory.mp4
#EXTINF:-1, A Girl Walks Home Alone at Night
http://vod3.freeddns.org:80/217182172100/AGirlWalks.mp4
#EXTINF:-1, A Good Year
http://vod1.freeddns.org:80/519692115/AGoodYear.mp4
#EXTINF:-1, A Haunted House
http://vod1.freeddns.org:80/519692115/AHauntedHouse.mp4
#EXTINF:-1, A Haunted House 2
http://vod1.freeddns.org:80/519692115/AHauntedHouse2.mp4
#EXTINF:-1, A History of Violence
http://vod3.freeddns.org:80/195181173146/movies/AHistoryOfViolence-2005.mp4
#EXTINF:-1, A House In The Hills
http://vod3.freeddns.org:80/195181173146/A.House.In.The.Hills.1993.720p.AMZN.WEB-DL.DDP2.0.H.264-ABM.mp4
#EXTINF:-1, A Leaf of Faith
http://vod3.freeddns.org:80/195181173146/A.Leaf.Of.Faith.2018.720p.WEBRip.x264.mp4
#EXTINF:-1, A Little Chaos
http://vod3.freeddns.org:80/151809610/ALittleChaos.mp4
#EXTINF:-1, A Madea Christmas
http://vod3.freeddns.org:80/1492026922/AMadeaChristmas.mp4
#EXTINF:-1, A Man Called Ove (English Subs)
http://vod3.freeddns.org:80/151809610/AManCalledOve.mp4
#EXTINF:-1, A Merry Friggin\ Christmas
http://vod3.freeddns.org:80/217182172100/XmasFrig.mp4
#EXTINF:-1, A Million Ways to Die in the West
http://vod5.freeddns.org:80/95154195215/boxoffice2/MillionWaysToDieInTheWest-2014.mp4
#EXTINF:-1, A Moment to Remember
http://vod3.freeddns.org:80/195181173146/A.Moment.to.Remember.2004.DC.KOREAN.1080p.BluRay.H264.AAC-VXT.mp4
#EXTINF:-1, A Monster Calls
http://vod3.freeddns.org:80/51254199141/AMonsterCalls.mp4
#EXTINF:-1, A Most Violent Year
http://vod1.freeddns.org:80/148251187141/ViolentYear.mp4
#EXTINF:-1, A Mother\s Nightmare
http://vod3.freeddns.org:80/195181173146/A.Mothers.Nightmare.2012.1080p.WEBRip.x264-RARBG.mp4
#EXTINF:-1, A Nightmare on Elm Street
http://vod3.freeddns.org:80/195181164146/NightmareOnElmStreet(2010).mp4
#EXTINF:-1, A Nutcracker Christmas
http://vod3.freeddns.org:80/195181164146/NutcrackerChristmas2016.mp4
#EXTINF:-1, A Patch of Fog
http://vod3.freeddns.org:80/151809784/APatchofFog.mp4
#EXTINF:-1, A Perfect Day
http://vod3.freeddns.org:80/51254199141/perfectday.mp4
#EXTINF:-1, A Princess for Christmas
http://vod3.freeddns.org:80/217182164125/APrincessForChristmas.mp4
#EXTINF:-1, A Private War
http://vod3.freeddns.org:80/145239129162/old0619/APrivateWar-2018.mp4
#EXTINF:-1, A Prophet
http://vod3.freeddns.org:80/195181173146/movies/UnProphete-2009.mp4
#EXTINF:-1, A Quiet Place
http://vod3.freeddns.org:80/14920266145/AQuietPlace-2018.mp4
#EXTINF:-1, A Record of Sweet Murderer
http://vod3.freeddns.org:80/195181173146/A.Record.Of.Sweet.Murderer.2014.JAPANESE.720p.BluRay.H264.AAC-VXT.mp4
#EXTINF:-1, A Score to Settle
http://vod3.freeddns.org:80/14920266145/A.Score.to.Settle.mp4
#EXTINF:-1, A Time to Kill
http://vod1.freeddns.org:80/1482511210/atimetokill.mp4
#EXTINF:-1, A Very British Gangster
http://vod3.freeddns.org:80/217182172100/Gangster.mp4
#EXTINF:-1, A Very English Scandal
http://vod3.freeddns.org:80/145239129162/AVeryEnglishScandal-s01e03.mp4
#EXTINF:-1, A Very Murray Christmas
http://vod3.freeddns.org:80/195181173146/A.Very.Murray.Christmas.2015.720p.WEBRip.x264-RARBG.mp4
#EXTINF:-1, A View to a Kill
http://vod3.freeddns.org:80/14920271211/aviewtokill.mp4
#EXTINF:-1, A Walk Among the Tombstones
http://vod3.freeddns.org:80/195181164146/AWalkAmongtheTombstones.mp4
#EXTINF:-1, A Walk to Remember
http://vod3.freeddns.org:80/519682224/awalktoremember.mp4
#EXTINF:-1, A Wrinkle in Time
http://vod5.freeddns.org:80/95154195215/boxoffice/AWrinkleInTime-2018.mp4
#EXTINF:-1, ¡Three Amigos!
http://vod3.freeddns.org:80/519682224/threeamigos.mp4
#EXTINF:-1, Above and Beyond
http://vod1.freeddns.org:80/1518018170/AboveandBeyond.mp4
#EXTINF:-1, Above the Shadows
http://vod3.freeddns.org:80/14920266145/AboveTheShadows-2019.mp4
#EXTINF:-1, Abraham Lincoln: Vampire Hunter
http://vod3.freeddns.org:80/195181164146/AbrahamLincolnVampireHunter.mp4
#EXTINF:-1, Absolute Power
http://vod3.freeddns.org:80/145239129162/AbsolutePower.mp4
#EXTINF:-1, Absolutely Anything
http://vod3.freeddns.org:80/217182172100/AbsolutelyAnything.mp4
#EXTINF:-1, Accepted
http://vod1.freeddns.org:80/519692115/Accepted.mp4
#EXTINF:-1, Ace High
http://vod3.freeddns.org:80/195181173146/movies/AceHigh-1968.mp4
#EXTINF:-1, Ace Ventura: Pet Detective
http://vod3.freeddns.org:80/217182172100/PetDick.mp4
#EXTINF:-1, Ace Ventura: When Nature Calls
http://vod3.freeddns.org:80/1492026922/ace.mp4
#EXTINF:-1, Action Man Charlie (Charlie) (Hindi Dub)
http://vod3.freeddns.org:80/195181164146/ActionManCharlie.mp4
#EXTINF:-1, Action Point
http://vod5.freeddns.org:80/95154195215/boxoffice/ActionPoint-2018.mp4
#EXTINF:-1, Acts of Vengeance
http://vod3.freeddns.org:80/195181164146/ActsofVengeance.mp4
#EXTINF:-1, Acts of Violence
http://vod1.freeddns.org:80/14920220391/ActsOfViolence.mp4
#EXTINF:-1, Adam Sandler: 100% Fresh
http://vod3.freeddns.org:80/519682224/AdamSandler100PercentFresh.mp4
#EXTINF:-1, Addams Family Values
http://vod3.freeddns.org:80/195181164146/AddamsFamilyValues.mp4
#EXTINF:-1, Addicted to Sexting
http://vod1.freeddns.org:80/519692115/sexting.mp4
#EXTINF:-1, Adele Live in New York
http://vod3.freeddns.org:80/217182172100/adelelive.mp4
#EXTINF:-1, Adopt a Highway
http://vod3.freeddns.org:80/14920266145/AdoptAHighway-2019.mp4
#EXTINF:-1, Adopting Trouble
http://vod3.freeddns.org:80/195181173146/movies/AdoptingTrouble-2016.mp4
#EXTINF:-1, Adrift
http://vod5.freeddns.org:80/95154195215/boxoffice/Adrift-2018.mp4
#EXTINF:-1, Adventureland
http://vod1.freeddns.org:80/519692115/Adventureland.mp4
#EXTINF:-1, Adventures of Aladdin
http://vod3.freeddns.org:80/14920266145/AdventuresofAladdin.mp4
#EXTINF:-1, After Darkness
http://vod5.freeddns.org:80/95154195215/boxoffice2/After.Darkness.2018.720p.WEBRip.x264.mp4
#EXTINF:-1, After Hours
http://vod3.freeddns.org:80/519682224/AfterHours-1985.mp4
#EXTINF:-1, After Hours Season 1 E1-E6
http://vod1.freeddns.org:80/519692115/afterhours-s01e06.mp4
#EXTINF:-1, After the Wedding
http://vod3.freeddns.org:80/14920266145/AfterTheWedding-2019.mp4
#EXTINF:-1, Aftermath
http://vod1.freeddns.org:80/1518018170/Aftermath.mp4
#EXTINF:-1, Air
http://vod3.freeddns.org:80/151809610/Air.mp4
#EXTINF:-1, Air Strike
http://vod5.freeddns.org:80/95154195215/boxoffice2/AirStrike-2018.mp4
#EXTINF:-1, Airport
http://vod1.freeddns.org:80/1518018170/Airport.mp4
#EXTINF:-1, Aladdin (2019)
http://vod3.freeddns.org:80/14920266145/Aladdin-2019.mp4
#EXTINF:-1, Alex Cross
http://vod3.freeddns.org:80/151809784/AlexCross.mp4
#EXTINF:-1, Alias Jesse James
http://vod5.freeddns.org:80/95154195215/boxoffice/AliasJesseJames-1959.mp4
#EXTINF:-1, Alien
http://vod3.freeddns.org:80/195181164146/Alien.mp4
#EXTINF:-1, Alien Abduction
http://vod3.freeddns.org:80/217182172100/AlienAb.mp4
#EXTINF:-1, Alien Expedition
http://vod3.freeddns.org:80/145239129162/old0619/AlienExpeditionVoyageIntoFear-2018.mp4
#EXTINF:-1, Alien vs. Predator
http://vod1.freeddns.org:80/519692115/AlienVsPredator.mp4
#EXTINF:-1, Alien: Resurrection
http://vod3.freeddns.org:80/217182172100/AlienR.mp4
#EXTINF:-1, Aliens
http://vod3.freeddns.org:80/195181164146/Aliens.mp4
#EXTINF:-1, Aliens of the Deep
http://vod3.freeddns.org:80/51254199141/AliensDeep.mp4
#EXTINF:-1, Aliens vs Predator: Requiem
http://vod1.freeddns.org:80/519692115/AliensVsPredator-Requiem.mp4
#EXTINF:-1, Aliens: Zone of Silence
http://vod3.freeddns.org:80/195181173146/Aliens.Zone.Of.Silence.2017.720p.WEBRip.x264.mp4
#EXTINF:-1, Alive
http://vod3.freeddns.org:80/14920271211/Alive.mp4
#EXTINF:-1, All About Eve
http://vod3.freeddns.org:80/195181164146/AllAboutEve.mp4
#EXTINF:-1, All Access 24/7 GGG Golovkin vs Daniel Jacobs Boxing
http://vod3.freeddns.org:80/14920271211/gggjacobsallaccess.mp4
#EXTINF:-1, All Access Mayweather vs McGregor
http://vod3.freeddns.org:80/14920271211/sport/MayweatherVsMcGregor-AllAccess-s01e03.mp4
#EXTINF:-1, All Access: Mayweather v Berto Part 1
http://vod1.freeddns.org:80/1482511210/AllAccess1.mp4
#EXTINF:-1, All Access: Mayweather v Berto Part 2
http://vod3.freeddns.org:80/151809610/Berto2.mp4
#EXTINF:-1, All Access: Mayweather v Berto Part 3
http://vod3.freeddns.org:80/151809610/Berto3.mp4
#EXTINF:-1, All Elite Wrestling: Dark 03/12/19
http://vod3.freeddns.org:80/195181173146/wwe/AEW-DARK-2019-12-03.mp4
#EXTINF:-1, All Elite Wrestling: Dark 05/11/19
http://vod3.freeddns.org:80/195181173146/wwe/AEW-DARK-2019-11-05.mp4
#EXTINF:-1, All Elite Wrestling: Dark 07/01/20
http://vod3.freeddns.org:80/195181173146/wwe/AEW-DARK-2020-01-07.mp4
#EXTINF:-1, All Elite Wrestling: Dark 08/10/19
http://vod3.freeddns.org:80/195181173146/wwe/AEW-Dark-2019-10-08.mp4
#EXTINF:-1, All Elite Wrestling: Dark 08/11/19
http://vod3.freeddns.org:80/195181173146/wwe/AEW-DARK-2019-11-08.mp4
#EXTINF:-1, All Elite Wrestling: Dark 10/12/19
http://vod3.freeddns.org:80/195181173146/wwe/AEW-DARK-2019-12-10.mp4
#EXTINF:-1, All Elite Wrestling: Dark 14/01/20
http://vod3.freeddns.org:80/195181173146/wwe/AEW-DARK-2020-01-14.mp4
#EXTINF:-1, All Elite Wrestling: Dark 15/10/19
http://vod3.freeddns.org:80/195181173146/wwe/AEW-Dark-2019-10-15.mp4
#EXTINF:-1, All Elite Wrestling: Dark 17/12/19
http://vod3.freeddns.org:80/195181173146/wwe/AEW-DARK-2019-12-17.mp4
#EXTINF:-1, All Elite Wrestling: Dark 19/11/19
http://vod3.freeddns.org:80/195181173146/wwe/AEW-DARK-2019-11-19.mp4
#EXTINF:-1, All Elite Wrestling: Dark 21/01/20
http://vod3.freeddns.org:80/195181173146/wwe/AEW-DARK-2020-01-21.mp4
#EXTINF:-1, All Elite Wrestling: Dark 22/10/19
http://vod3.freeddns.org:80/195181173146/wwe/AEW-DARK-2019-10-22.mp4
#EXTINF:-1, All Elite Wrestling: Dark 24/12/19
http://vod3.freeddns.org:80/195181173146/wwe/AEW-DARK-2019-12-24.mp4
#EXTINF:-1, All Elite Wrestling: Dark 26/11/19
http://vod3.freeddns.org:80/195181173146/wwe/AEW-DARK-2019-11-26.mp4
#EXTINF:-1, All Elite Wrestling: Dark 28/01/20
http://vod3.freeddns.org:80/195181173146/wwe/AEW-DARK-2020-01-28.mp4
#EXTINF:-1, All Elite Wrestling: Dark 29/10/19
http://vod3.freeddns.org:80/195181173146/wwe/AEW-DARK-2019-10-29.mp4
#EXTINF:-1, All Elite Wrestling: Dynamite 01/01/20
http://vod3.freeddns.org:80/195181173146/wwe/AEW-Dynamite-2020-01-01.mp4
#EXTINF:-1, All Elite Wrestling: Dynamite 02/10/19
http://vod3.freeddns.org:80/195181173146/wwe/AEW-Dynamite-2019-10-02.mp4
#EXTINF:-1, All Elite Wrestling: Dynamite 04/12/19
http://vod3.freeddns.org:80/195181173146/wwe/AEW-Dynamite-2019-12-04.mp4
#EXTINF:-1, All Elite Wrestling: Dynamite 05/02/20
http://vod3.freeddns.org:80/195181173146/wwe/AEW-Dynamite-2020-02-05.mp4
#EXTINF:-1, All Elite Wrestling: Dynamite 06/11/19
http://vod3.freeddns.org:80/195181173146/wwe/AEW-Dynamite-2019-11-06.mp4
#EXTINF:-1, All Elite Wrestling: Dynamite 08/01/20
http://vod3.freeddns.org:80/195181173146/wwe/AEW-Dynamite-2020-01-08.mp4
#EXTINF:-1, All Elite Wrestling: Dynamite 09/10/19
http://vod3.freeddns.org:80/195181173146/wwe/AEW-Dynamite-2019-10-09.mp4
#EXTINF:-1, All Elite Wrestling: Dynamite 11/12/19
http://vod3.freeddns.org:80/195181173146/wwe/AEW-Dynamite-2019-12-11.mp4
#EXTINF:-1, All Elite Wrestling: Dynamite 13/11/19
http://vod3.freeddns.org:80/195181173146/wwe/AEW-Dynamite-2019-11-13.mp4
#EXTINF:-1, All Elite Wrestling: Dynamite 15/01/20
http://vod3.freeddns.org:80/195181173146/wwe/AEW-Dynamite-2020-01-15.mp4
#EXTINF:-1, All Elite Wrestling: Dynamite 16/10/19
http://vod3.freeddns.org:80/195181173146/wwe/AEW-Dynamite-2019-10-16.mp4
#EXTINF:-1, All Elite Wrestling: Dynamite 18/12/19
http://vod3.freeddns.org:80/195181173146/wwe/AEWDynamite-2019-12-18.mp4
#EXTINF:-1, All Elite Wrestling: Dynamite 20/11/19
http://vod3.freeddns.org:80/195181173146/wwe/AEW-Dynamite-2019-11-20.mp4
#EXTINF:-1, All Elite Wrestling: Dynamite 22/01/20
http://vod3.freeddns.org:80/195181173146/wwe/AEW-Dynamite-2020-01-22.mp4
#EXTINF:-1, All Elite Wrestling: Dynamite 23/10/19
http://vod3.freeddns.org:80/195181173146/wwe/AEW-Dynamite-2019-10-23.mp4
#EXTINF:-1, All Elite Wrestling: Dynamite 25/12/19
http://vod3.freeddns.org:80/195181173146/wwe/AEW-Dynamite-2019-12-25.mp4
#EXTINF:-1, All Elite Wrestling: Dynamite 27/11/19
http://vod3.freeddns.org:80/195181173146/wwe/AEW-Dynamite-2019-11-27.mp4
#EXTINF:-1, All Elite Wrestling: Dynamite 29/01/20
http://vod3.freeddns.org:80/195181173146/wwe/AEW-Dynamite-2020-01-29.mp4
#EXTINF:-1, All Elite Wrestling: Dynamite 30/10/19
http://vod3.freeddns.org:80/195181173146/wwe/AEW-Dynamite-2019-10-30.mp4
#EXTINF:-1, All Girls Garage Season 8
http://vod3.freeddns.org:80/145239129162/AllGirlsGarage-s08e01.mp4
#EXTINF:-1, All Girls Weekend
http://vod3.freeddns.org:80/51254199141/allgirlsweekend.mp4
#EXTINF:-1, All Good Things
http://vod3.freeddns.org:80/195181173146/movies/AllGoodThings.mp4
#EXTINF:-1, All Is True
http://vod3.freeddns.org:80/14920266145/AllIsTrue-2018.mp4
#EXTINF:-1, Allied
http://vod3.freeddns.org:80/51254199141/Allied.mp4
#EXTINF:-1, Almost Christmas
http://vod3.freeddns.org:80/1492026922/AlmostChristmas.mp4
#EXTINF:-1, Alone With Her
http://vod1.freeddns.org:80/519692115/AloneWithHer.mp4
#EXTINF:-1, Along Came a Spider
http://vod1.freeddns.org:80/519692115/alongspider.mp4
#EXTINF:-1, Along Came Polly
http://vod3.freeddns.org:80/1492028071/alongcamepolly.mp4
#EXTINF:-1, Alpha
http://vod5.freeddns.org:80/95154195215/boxoffice2/Alpha-2018.mp4
#EXTINF:-1, Alpha and Omega: The Big Fureeze
http://vod3.freeddns.org:80/1492026922/alphaomegafureeze.mp4
#EXTINF:-1, Already Gone
http://vod3.freeddns.org:80/14920266145/AlreadyGone.mp4
#EXTINF:-1, Already Tomorrow in Hong Kong
http://vod3.freeddns.org:80/151809784/AlreadyTomorrowinHongKong.mp4
#EXTINF:-1, Altar
http://vod3.freeddns.org:80/151809610/Altar.mp4
#EXTINF:-1, Alternate Endings: Six New Ways to Die in America
http://vod3.freeddns.org:80/195181173146/Alternate.Endings.Six.New.Ways.to.Die.in.America.2019.720p.AMZN.WEB-DL.DDP5.1.H.264-NTG.mp4
#EXTINF:-1, Alvin and the Chipmunks: The Road Chip
http://vod3.freeddns.org:80/51254199141/alvin.mp4
#EXTINF:-1, Always - Sunset on Third Street 3
http://vod3.freeddns.org:80/195181173146/Always.Sunset.on.Third.Street.3.2012.JAPANESE.1080p.BluRay.H264.AAC-VXT.mp4
#EXTINF:-1, Always Be My Maybe
http://vod3.freeddns.org:80/14920266145/AlwaysBeMyMaybe-2019.mp4
#EXTINF:-1, America\s Next Top Model Season 24
http://vod3.freeddns.org:80/195181164146/series/AmericasNextTopModel-S24E14.mp4
#EXTINF:-1, America\s Planned War on Britain
http://vod1.freeddns.org:80/519692115/USAUK.mp4
#EXTINF:-1, America\s War on Drugs
http://vod3.freeddns.org:80/1492026922/series/WaronDrugs-s01e04.mp4
#EXTINF:-1, American Gangster
http://vod3.freeddns.org:80/195181164146/AmericanGangster.mp4
#EXTINF:-1, American Graffiti
http://vod3.freeddns.org:80/1492026922/AmericanGraffiti.mp4
#EXTINF:-1, American Hangman
http://vod3.freeddns.org:80/1492028071/AmericanHangman.mp4
#EXTINF:-1, American Heist
http://vod3.freeddns.org:80/151809610/AmericanHeist.mp4
#EXTINF:-1, American Music Awards 2016
http://vod1.freeddns.org:80/148251187141/AMAs.mp4
#EXTINF:-1, American Odyssey Season 1
http://vod3.freeddns.org:80/195181164146/series/AmericanOdyssey-s01e13.mp4
#EXTINF:-1, American Pie 2
http://vod3.freeddns.org:80/217182172100/AmericanPie2.mp4
#EXTINF:-1, American Pie 3 - The Wedding
http://vod3.freeddns.org:80/217182172100/AmericanPie3-TheWedding.mp4
#EXTINF:-1, American Pie 4 - Reunion
http://vod3.freeddns.org:80/217182172100/AmericanPie4-TheReunion.mp4
#EXTINF:-1, American Pie 5 - Band Camp
http://vod3.freeddns.org:80/217182172100/AmericanPie5-BandCamp.mp4
#EXTINF:-1, American Pie 6 - The Naked Mile
http://vod3.freeddns.org:80/217182172100/AmericanPie6-TheNakedMile.mp4
#EXTINF:-1, American Pie 7 - Beta House
http://vod3.freeddns.org:80/217182172100/AmericanPie7-BetaHouse.mp4
#EXTINF:-1, An Actor Prepares
http://vod5.freeddns.org:80/95154195215/boxoffice2/AnActorPrepares-2018.mp4
#EXTINF:-1, An Affair to Remember
http://vod3.freeddns.org:80/51254199141/AnAffairToRemember.mp4
#EXTINF:-1, An American Haunting
http://vod1.freeddns.org:80/519692115/AnAmericanHaunting.mp4
#EXTINF:-1, An American Tail
http://vod3.freeddns.org:80/1492028071/AnAmericanTail.mp4
#EXTINF:-1, An Interview with God
http://vod3.freeddns.org:80/14920266145/AnInterviewWithGod-2018.mp4
#EXTINF:-1, An Officer and a Gentleman
http://vod3.freeddns.org:80/195181164146/officer.mp4
#EXTINF:-1, Anatomy of a Murder
http://vod3.freeddns.org:80/195181173146/Anatomy.Of.A.Murder.1959.720p.BluRay.x264.mp4
#EXTINF:-1, Anchorman 2: The Legend Continues
http://vod1.freeddns.org:80/13774202158/Anch2.mp4
#EXTINF:-1, Anchorman: The Legend of Ron Burgundy
http://vod3.freeddns.org:80/217182172100/Anchor.mp4
#EXTINF:-1, Angel Has Fallen
http://vod3.freeddns.org:80/14920266145/AngelHasFallen-2019.mp4
#EXTINF:-1, Angel Heart
http://vod3.freeddns.org:80/195181164146/AngelHeart.mp4
#EXTINF:-1, Antwone Fisher
http://vod3.freeddns.org:80/195181173146/Antwone.Fisher.2002.720p.BluRay.x264.mp4
#EXTINF:-1, Antz
http://vod3.freeddns.org:80/217182172100/antz.mp4
#EXTINF:-1, Any Body Can Dance 2
http://vod3.freeddns.org:80/217182172100/ABCD2.mp4
#EXTINF:-1, Any Given Sunday
http://vod3.freeddns.org:80/14920271211/anygivensunday.mp4
#EXTINF:-1, Any Which Way You Can
http://vod3.freeddns.org:80/195181173146/movies/AnyWhichWayYouCan-1980.mp4
#EXTINF:-1, Apollo 11
http://vod3.freeddns.org:80/195181173146/Apollo.11.2019.720p.BluRay.H264.AAC-RARBG.mp4
#EXTINF:-1, Apostle
http://vod5.freeddns.org:80/95154195215/boxoffice2/Apostle-2018.mp4
#EXTINF:-1, Aquamarine
http://vod3.freeddns.org:80/151809784/Aquamarine.mp4
#EXTINF:-1, Armed
http://vod5.freeddns.org:80/95154195215/boxoffice2/Armed-2018.mp4
#EXTINF:-1, Armed Response
http://vod3.freeddns.org:80/519682224/armedresponse.mp4
#EXTINF:-1, Armored
http://vod1.freeddns.org:80/519692115/Armored.mp4
#EXTINF:-1, Army: Behind the New Frontlines
http://vod3.freeddns.org:80/195181164146/series/Army-S01E03.mp4
#EXTINF:-1, Around the World in 80 Days (1956)
http://vod3.freeddns.org:80/519682224/AroundTheWorldIn80Days-1956.mp4
#EXTINF:-1, Astro Kid
http://vod3.freeddns.org:80/14920266145/AstroKid.mp4
#EXTINF:-1, Astronaut
http://vod3.freeddns.org:80/14920266145/Astronaut.2019.720p.WEB-DL.XviD.AC3-FGT.mp4
#EXTINF:-1, Atlantic City
